id,name,surname,birthday,address,email,passport
307,Пахом,Наумов,1989-05-26,Панама п. Плесецк пер. Льва Толстого д. 738 к. 9/8 876017,prov_39@example.org,P07058549
308,Август,Ильина,1971-01-03,Кот-д’Ивуар г. Кашхатау бул. Микрорайон д. 1 252274,viktor_44@example.com,U28902568
309,Савва,Рябова,1951-09-15,Антигуа и Барбуда г. Шахты ул. Папанина д. 279 стр. 7 914821,shcherbakovstojan@example.com,I62712462
310,Ираида,Дроздов,1972-02-02,Сенегал г. Хужир алл. Зеленая д. 965 к. 1/3 209901,ustinovazoja@example.org,635662100
311,Артем,Соловьева,1992-09-07,Венесуэла клх Хатанга наб. 60 лет Октября д. 352 стр. 5 033665,vera_1982@example.net,D94117944
312,Потап,Щербакова,1974-12-29,Латвия г. Объячево наб. Курганная д. 81 764344,afanasevmitofan@example.com,237741983
313,Ангелина,Киселев,1996-05-02,Уругвай к. Анива ул. Горная д. 4/2 685249,foka37@example.net,305255457
314,Федот,Комарова,2006-12-22,Папуа ст. Катайск ш. Логовое д. 84 стр. 5 493249,ilarion31@example.com,563364620
315,Мир,Щукина,1991-11-05,Гондурас д. Орел ш. Станиславского д. 2 к. 5/5 723705,aleksandr_26@example.com,898104912
316,Алла,Третьяков,2020-11-24,Россия д. Кизел наб. Степана Разина д. 4/9 стр. 97 202905,samsonovamarfa@example.net,287995985
317,Эмилия,Блохин,1975-05-07,Гаити клх Всеволожск наб. Заливная д. 608 647953,nikitaburov@example.net,J35172687
318,Полина,Маслов,1983-03-25,Намибия к. Нязепетровск ул. Ломоносова д. 6 723509,gnikitina@example.com,015294847
319,Елизавета,Смирнов,2016-06-24,Гаити к. Армавир бул. Кутузова д. 5 к. 1/9 062913,bazhen1991@example.net,559760999
320,Анжелика,Соболев,1998-02-19,Палау с. Сунтар ш. Северное д. 19 стр. 997 354469,anzhelika2005@example.org,960064225
321,Самсон,Зуева,2018-10-04,Сербия д. Игарка пер. Ломоносова д. 7/5 стр. 55 530178,karl94@example.com,Y12323299
322,Евпраксия,Титова,1981-01-31,Бруней к. Астрахань ул. Элеваторная д. 772 625420,lebedevmilen@example.com,J80583000
323,Фрол,Ильин,1988-02-14,Россия ст. Канск пр. Краснодарский д. 7 к. 11 852099,ribakovtrifon@example.org,623030733
324,Корнил,Кузнецов,2016-01-09,Вануату с. Соболево пер. Запрудный д. 7 к. 8/4 086266,bazhen2023@example.org,W71339737
325,Рубен,Михеева,1979-10-06,Боливия с. Тольятти алл. Абрикосовая д. 3 143484,mina_65@example.com,R91261717
326,Ипполит,Соколова,1977-04-24,Эфиопия д. Архыз наб. Стадионная д. 59 к. 1/1 044380,sila_1988@example.org,R57071788
327,Геннадий,Князев,1982-01-11,Папуа к. Кировск (Мурм.) ул. Леваневского д. 87 к. 3 409240,raisa08@example.org,B33566913
328,Леонтий,Пономарев,2004-01-20,Науру д. Ейск пер. Малый д. 5/7 020871,suhanovaolimpiada@example.com,U46584696
329,Никифор,Коновалова,1970-11-03,Афганистан с. Луховицы пр. Заливный д. 91 к. 654 678155,denisovajulija@example.net,113765685
330,Степан,Боброва,2000-11-14,Мали к. Алапаевск бул. Мусы Джалиля д. 623 239303,blinovladislav@example.net,L06531230
331,Екатерина,Белоусов,1955-07-24,Мексика с. Белокуриха наб. Щербакова д. 59 стр. 485 058983,llobanov@example.com,597249733
332,Егор,Суханов,1977-11-04,Суринам к. Кропоткин (Краснод.) бул. Учительский д. 2 к. 1 385422,tatjana_2016@example.net,779024339
333,Бажен,Шарапова,2008-07-28,Польша г. Абинск ш. Черемушки д. 8 стр. 9/2 573195,doroninfeliks@example.org,206598615
334,Егор,Данилов,1976-09-04,Чад клх Ямбург бул. 1 Мая д. 97 454281,gennadi1974@example.org,C14327785
335,Лучезар,Чернова,2022-11-16,Суринам с. Буденновск бул. Харьковский д. 7 к. 91 356601,suvorovuljan@example.com,Z01862546
336,Юрий,Голубева,2023-08-15,Финляндия д. Ханты-Мансийск наб. Рылеева д. 4/2 стр. 91 701748,abramovarhip@example.net,800705863
337,Митофан,Евдокимов,1954-08-13,Таиланд к. Артем алл. Мельничная д. 77 561919,tkrjukova@example.org,325023910
338,Раиса,Копылов,1984-02-14,Маврикий д. Двинской наб. Вишневая д. 43 595100,judinfeliks@example.net,904530982
339,Милован,Соколова,1992-06-04,Коморы ст. Калач-на-Дону пер. Трактовый д. 792 268804,vatslav2006@example.com,674036487
340,Дорофей,Зуев,2012-08-17,Словения клх Арсеньев ул. Юности д. 59 стр. 9/9 288633,timofeevkarp@example.org,G15234522
341,Иннокентий,Соколова,2022-05-06,Хорватия п. Волхов ул. Цветочная д. 11 стр. 9/9 668295,denis1983@example.org,M97124890
342,Карп,Лебедев,1977-05-19,Суринам к. Карачаевск алл. Казанская д. 609 к. 5/5 800351,avde27@example.com,E77151557
343,Вера,Мартынова,1955-12-10,Руанда ст. Балашов пр. Фурманова д. 7 557590,arodionov@example.com,Y74822339
344,Сократ,Потапова,2005-01-02,Ливан с. Осташков наб. Партизанская д. 4 стр. 101 674275,zinovi68@example.net,M13855635
345,Милан,Ситников,1973-11-14,Белиз д. Урай пер. 50 лет ВЛКСМ д. 73 стр. 91 756214,radovanbeljakov@example.org,591919172
346,Давыд,Соколова,1973-05-26,Камерун с. Северодвинск бул. Нагорный д. 6 стр. 99 494452,mir_2013@example.com,198474433
347,Вадим,Михайлов,1973-07-22,Ямайка ст. Богучар пр. Покровский д. 39 к. 30 150992,zikovartemi@example.org,698262765
348,Дарья,Лыткин,1995-11-22,Мексика г. Чокурдах ул. Восточная д. 99 259208,arseni58@example.net,D87521937
349,Дмитрий,Доронин,1984-03-08,Иордания с. Ступино наб. Коммуны д. 54 к. 7/3 221520,egorovchinnikov@example.net,L08831372
350,Еремей,Ефимов,2009-06-04,КНДР п. Нерчинск наб. Жуковского д. 3 к. 2 226031,panfil86@example.com,W45778800
351,Дарья,Герасимова,2008-08-15,Федеративные Штаты Микронезии к. Видное наб. Краснодарская д. 4 стр. 420 046406,nosovaekaterina@example.com,B93410390
352,Евдокия,Самсонова,1993-02-23,Непал с. Хасан ул. Городская д. 58 046425,askold61@example.com,U06829845
353,Богдан,Силина,2023-06-17,Казахстан ст. Елец бул. Виноградный д. 3/5 к. 918 571311,komarovmihe@example.org,508692084
354,Силантий,Некрасов,1977-01-23,Белиз клх Видное ул. Лесозаводская д. 3 стр. 8 062503,bobilevaantonina@example.com,X17334333
355,Роман,Носов,1945-01-16,Румыния г. Озеры наб. Просторная д. 7/9 388086,egornekrasov@example.org,566056943
356,Фёкла,Беляков,1964-05-13,Исландия п. Губкин ш. Докучаева д. 9/1 стр. 3/2 498950,amos_2019@example.org,480273453
357,Валентин,Субботина,1993-04-16,Парагвай д. Инта бул. Саратовский д. 4/7 к. 56 717416,iosif2004@example.org,Q14662595
358,Виссарион,Силина,1976-01-19,Венгрия д. Вуктыл бул. Подгорный д. 660 стр. 868 170323,vatslav_63@example.net,N41776479
359,Варфоломей,Кондратьева,1983-09-19,Сьерра-Леоне ст. Череповец ул. Железнодорожная д. 15 стр. 300 913236,samolovsaveli@example.com,109681451
360,Игорь,Максимова,1978-10-20,Самоа д. Ижевск ш. Славянское д. 9/8 стр. 5 985386,bkazakova@example.org,I29911706
361,Феврония,Макарова,1974-01-13,Белоруссия с. Осташков пер. Шишкина д. 52 181070,dorofeevevgeni@example.com,669488823
362,Ипполит,Анисимов,1950-04-12,Франция ст. Листвянка (Иркут.) пр. Нефтяников д. 705 к. 91 992625,ejakusheva@example.org,608255671
363,Радим,Кулаков,1997-09-01,Нигер к. Ербогачен бул. Подлесный д. 62 508261,hdmitrieva@example.com,502505081
364,Поликарп,Евсеев,2018-03-27,Колумбия п. Кяхта ш. Культуры д. 15 к. 794 250568,bobilevaleksandr@example.org,U94622277
365,Евграф,Михайлова,2019-04-03,Туркмения д. Югорск ул. Краснознаменная д. 8/1 705572,prokofi_84@example.net,348541961
366,Владислав,Петров,2005-09-18,Бельгия д. Валаам ул. Депутатская д. 451 стр. 8/5 756169,varfolome_91@example.org,882213957
367,Геннадий,Мартынов,2022-01-15,Австрия к. Ельня пер. Краснофлотский д. 2 515857,fedot42@example.com,268820968
368,Мечислав,Воробьев,1956-02-28,Сальвадор с. Усмань пер. Крылова д. 31 844198,darja_34@example.org,S51404744
369,Константин,Громова,2021-06-11,Словакия д. Чермоз пр. Главный д. 8 стр. 7/8 481970,zosima_97@example.com,G40779260
370,Мефодий,Пахомов,2017-10-30,Непал г. Кетченеры пер. Отрадный д. 8/4 стр. 5 981827,radim_27@example.com,092658904
371,Феоктист,Тимофеев,1957-10-31,Бруней клх Талдом пер. Томский д. 628 542692,bogdanjudin@example.net,853458175
372,Леонид,Воробьева,1999-06-10,Республика Конго к. Хасавюрт бул. Прибрежный д. 5 стр. 594 380507,mstislav76@example.com,241015002
373,Марина,Лапин,1954-07-10,Эритрея с. Павловский Посад алл. Куйбышева д. 5/6 563893,mtretjakova@example.org,O25051684
374,Наум,Мамонтов,1972-08-01,Коморы клх Благовещенск (Амур.) пер. Солнечный д. 4/6 541134,valerjan_2004@example.com,K12308256
375,Мартьян,Колесников,1970-09-18,Соломоновы Острова д. Белый Яр (Томск.) ул. Некрасова д. 2 024633,vasili2006@example.org,978453625
376,Маргарита,Родионов,1958-07-10,Хорватия ст. Озеры пер. Кавказский д. 4 к. 26 267469,leonti_2023@example.com,A01793478
377,Людмила,Тихонов,1951-10-07,Мексика клх Белоярский ш. Карьерное д. 11 к. 53 253622,trofim_05@example.net,P72099296
378,Виктория,Михеев,1983-05-20,Словакия г. Армавир алл. Карла Либкнехта д. 532 стр. 3 979131,lbaranov@example.org,826909465
379,Леонид,Михайлов,1971-01-04,Намибия ст. Череповец ш. Ермака д. 27 стр. 3/9 845361,zosima1995@example.net,563947423
380,Тихон,Хохлов,1980-07-19,Нидерланды д. Гусь-Хрустальный бул. Павлова д. 8/5 к. 603 691434,polina_1976@example.com,692321667
381,Вышеслав,Носков,1978-04-05,Никарагуа с. Белый Яр (Томск.) наб. Папанина д. 8 273643,prokl82@example.com,606173105
382,Всемил,Калашникова,1952-03-25,Габон д. Лысьва бул. Харьковский д. 7 к. 4 326029,prokofibikov@example.com,W82094922
383,Алевтина,Федосеева,2002-05-31,Никарагуа д. Внуково (метеост.) наб. Таманская д. 256 767602,vladlen_72@example.com,912258780
384,Ермил,Стрелкова,1973-08-23,Болгария к. Солнечногорск ш. 50 лет Октября д. 8/6 к. 603 204610,isa_2011@example.com,347226943
385,Остап,Смирнова,1972-05-03,Маврикий г. Апшеронск пр. Ульяновский д. 74 к. 76 181777,kolobovavksenti@example.com,693543491
386,Радован,Исакова,1990-11-20,Эфиопия к. Чегем ш. Красное д. 906 121845,georgi2001@example.net,B97768722
387,Галактион,Агафонова,1953-07-07,Сенегал ст. Серов ш. Калужское д. 114 904277,efremovevstigne@example.org,P94579876
388,Ангелина,Силина,1955-08-18,Тринидад и Тобаго клх Аша алл. Плеханова д. 7/7 к. 833 480860,nikonovparfen@example.org,333724843
389,Моисей,Ефимов,1973-05-06,Китай п. Саранск наб. Каштановая д. 14 стр. 570 126965,vasilevamilitsa@example.net,X30868709
390,Аникита,Поляков,1958-12-30,Иордания с. Пушкино (Моск.) пр. Кузнецова д. 84 к. 58 848475,nkondrateva@example.org,672854240
391,Мирослав,Фокина,1952-08-15,Эстония г. Кузнецк ш. Ивановское д. 387 669144,beljaevprov@example.org,G54535582
392,Милий,Макарова,2019-05-12,Республика Конго п. Ребриха ул. Пионерская д. 1 992433,leonti_95@example.net,222999883
393,Порфирий,Корнилова,1983-01-18,Иордания с. Губкинский ул. Толстого д. 170 758051,panfil_2023@example.net,D60940078
394,Арсений,Антонов,2021-12-28,Малайзия клх Верхний Уфалей ш. Подгорное д. 9 246117,jaropolk_1990@example.org,P85937823
395,Ростислав,Калашников,2023-07-09,Катар г. Лабинск наб. Коммунистическая д. 3 к. 949 250210,zosima_28@example.net,G84460906
396,Валентин,Лыткина,1956-07-09,Чили д. Озеры пер. Свободный д. 14 стр. 53 969772,spartakpopov@example.org,391176557
397,Валентина,Зиновьев,2012-07-22,Вануату п. Мытищи наб. Локомотивная д. 2/1 стр. 1/3 048305,knjazevemeljan@example.net,265504169
398,Ольга,Никонова,1995-03-09,Швейцария клх Нарьян-Мар алл. Весенняя д. 2/7 стр. 13 706818,agap_2011@example.com,M08951906
399,Стоян,Куликова,2006-03-25,Словакия д. Сарапул пер. Красный д. 77 стр. 567 240237,fevronija_85@example.org,W06812215
400,Анисим,Тихонова,1989-06-07,Монголия с. Рязань пр. Максима Горького д. 648 стр. 28 826165,ladislav_1978@example.net,894886463
401,Эдуард,Субботин,1993-12-06,Аргентина г. Орехово-Зуево алл. Покровская д. 71 679723,timofe_1980@example.com,R55849095
402,Кира,Жданова,1966-04-01,Пакистан п. Нерчинск наб. Песчаная д. 25 к. 40 119440,silinemmanuil@example.org,Z47111845
403,Алина,Петухов,1992-02-21,Пакистан с. Качканар ш. Придорожное д. 7 205979,lmerkusheva@example.net,619456899
404,Ипатий,Морозова,1948-07-12,Канада г. Двинской алл. Загородная д. 6/4 436830,ysorokin@example.net,Q74604393
405,Надежда,Белозеров,1961-12-26,Молдавия ст. Ханты-Мансийск пр. Хуторской д. 1/9 стр. 7 561439,feoktist_91@example.org,L04453269
406,Евфросиния,Павлова,2014-04-28,Тонга клх Геленджик ш. Студенческое д. 38 стр. 535 858298,silinostromir@example.org,378658824
407,Всемил,Пестова,1958-12-30,Колумбия клх Асбест алл. Заречная д. 45 633557,kornilovvadim@example.com,O64808620
408,Куприян,Исаев,2012-05-09,Нигер ст. Середниково ул. Волкова д. 7 к. 59 801403,drozdovanatoli@example.org,478691996
409,Любосмысл,Симонов,1978-09-26,Пакистан клх Кажим наб. Калужская д. 1 к. 84 982684,adamnikiforov@example.net,T34156992
410,Кондрат,Шарова,2002-10-27,Израиль д. Печора наб. Карла Маркса д. 3 573154,arhip49@example.com,050860715
411,Селиван,Доронина,1960-04-20,Германия клх Звенигород бул. Курчатова д. 527 стр. 6/6 409342,blinovbudimir@example.org,W86495767
412,Измаил,Евсеева,2016-04-03,Судан д. Юровск ш. Клары Цеткин д. 11 к. 3 723892,vlasovafanasi@example.net,712616422
413,Милан,Сысоева,2012-08-07,Сербия к. Кировск (Мурм.) пер. Речной д. 5 421311,german55@example.org,M16268538
414,Никандр,Виноградова,2002-10-19,Коморы с. Нефтеюганск наб. Сибирская д. 8 стр. 9/1 642774,sdjachkova@example.net,B51683492
415,Герман,Макарова,1986-07-20,Дания с. Солнечногорск ш. Садовое д. 9/3 стр. 3 992448,nikolaevaskold@example.net,X99018971
416,Викентий,Григорьев,1952-01-19,Ливия д. Арзамас пер. Ангарский д. 9/5 к. 95 081027,bojanbirjukov@example.com,324397530
417,Зинаида,Петров,2011-06-14,Латвия к. Петушки пер. Вокзальный д. 968 стр. 19 094965,adrian43@example.net,652451179
418,Лонгин,Егоров,1956-12-02,Тонга п. Челюскин ш. Песчаное д. 6 795307,viktorija_57@example.net,W74300380
419,Август,Самойлов,1977-10-18,США к. Амдерма пр. Макарова д. 678 972312,avdeevaviktorija@example.com,790230394
420,Климент,Степанов,1961-05-06,Мали к. Ухта ул. Котовского д. 73 к. 195 899616,bojan_2020@example.org,Z01642611
421,Адам,Титов,1959-11-23,Сент-Китс и Невис г. Эльтон ш. Папанина д. 33 797228,xvinogradov@example.net,F63123661
422,Авксентий,Сорокин,2000-09-04,Великобритания г. Павловский Посад алл. Ангарская д. 5/2 к. 1 718434,averjan1971@example.com,949006155
423,Вадим,Гришина,1949-02-03,Афганистан с. Омск наб. Восьмого Марта д. 3/6 стр. 8/7 355083,kondratizhuravlev@example.net,D38724071
424,Милица,Денисова,1992-11-04,Сан-Томе и Принсипи ст. Рязань ш. Лунное д. 1 стр. 9 358580,npetrova@example.net,476161183
425,Галактион,Гурьев,2017-07-27,Маршалловы Острова ст. Верещагино (Перм.) ш. Азовское д. 784 к. 818 515849,ignati84@example.com,K76503588
426,Самуил,Воронцова,1959-10-18,Демократическая Республика Конго п. Аршан (Бурят.) ш. Волгоградское д. 67 стр. 849 316971,panfil2002@example.com,790403407
427,Устин,Кузьмина,1960-11-27,Черногория п. Сковородино ул. Маяковского д. 345 739510,mjasnikovkonstantin@example.com,R27973796
428,Всеслав,Данилов,1968-05-26,Республика Конго д. Петрозаводск ул. Ленинградская д. 667 867264,maksimiljan_1970@example.com,D46201443
429,Александра,Орлов,2008-09-29,Намибия с. Красноселькуп ул. Кольцова д. 32 стр. 2/5 559133,polina2023@example.com,777905806
430,Геннадий,Никитин,1948-12-13,Непал ст. Зеленогорск (Ленин.) ш. Пушкинское д. 1/6 к. 15 275684,ashubina@example.net,Z87956120
431,Ладимир,Белоусов,1992-07-27,Эсватини д. Зеленоград бул. Металлургов д. 18 610078,kulagininnokenti@example.org,R59690274
432,Поликарп,Гусева,1960-10-17,Сальвадор п. Мокшан бул. Труда д. 1/1 к. 3 449821,maslovaksenija@example.com,O37471438
433,Борислав,Родионов,2013-09-17,ЮАР ст. Горячинск ул. Минская д. 46 647387,kornilovviktorin@example.org,383108909
434,Самсон,Давыдова,1977-05-01,Непал клх Щельяюр пр. Революционный д. 30 007807,jkornilov@example.org,283047891
435,Мирон,Петухов,1949-12-19,Либерия д. Ряжск наб. Краснофлотская д. 1/5 стр. 519 252431,izjaslavdementev@example.org,626520046
436,Василий,Колобова,1949-08-30,Доминика к. Завьялиха алл. Чайковского д. 2 стр. 12 709958,naumovagap@example.com,403735568
437,Полина,Федоров,2012-07-07,Мадагаскар к. Москва бул. Строителей д. 378 стр. 42 613281,karl_2018@example.org,354751721
438,Любомир,Сидорова,1984-07-31,Гвинея-Бисау к. Чермоз бул. Луначарского д. 4 к. 2 511284,egor_1999@example.org,490290067
439,Болеслав,Силина,1948-04-19,Кения г. Снежногорск (Мурм.) наб. Родниковая д. 435 к. 223 677444,karl83@example.com,A41343342
440,Виссарион,Костина,1981-12-19,Португалия с. Луга алл. Павлика Морозова д. 5 к. 3/3 415186,oabramova@example.net,Y58951556
441,Кузьма,Кузьмина,1961-01-13,Мексика г. Инта ш. Веселое д. 5/9 330551,grishinevdokim@example.org,954517564
442,Фадей,Костин,1990-07-19,Оман к. Черский наб. Труда д. 554 к. 15 718200,abramovmartin@example.com,G19108699
443,Казимир,Сорокин,2017-08-27,Эквадор клх Архангельск ул. Тургенева д. 80 984255,aleksandr2014@example.net,I71945313
444,Андрон,Суворова,1959-12-22,Ирландия с. Белогорск (Амур.) ул. Сахалинская д. 8/4 к. 2/5 741792,stojan_24@example.com,563086144
445,Викторин,Николаев,1977-09-28,Украина клх Кириши ул. Садовая д. 8 стр. 7/3 404722,averjan_31@example.org,441576797
446,Христофор,Миронова,1978-07-15,Босния и Герцеговина ст. Ноглики пр. Фурманова д. 94 к. 153 755525,gvinogradova@example.net,Y11144720
447,Дорофей,Мухин,1955-03-29,Соломоновы Острова д. Певек ш. Стадионное д. 3 к. 925 240971,dgorshkov@example.org,580930852
448,Мариан,Корнилов,2015-03-10,Науру к. Алапаевск алл. Главная д. 450 536882,vasili_80@example.net,Q90504207
449,Элеонора,Некрасова,1947-01-18,Гаити п. Шелехов ш. Сибирское д. 72 стр. 309 242015,aleksandra55@example.net,S27083284
450,Кирилл,Никитин,1977-09-21,Нигер д. Лабинск ш. Дружба д. 238 стр. 5/2 686978,innokentibelov@example.org,X94953028
451,Константин,Лукина,1946-09-25,Уругвай п. Северобайкальск пер. М.Горького д. 247 390018,nikiforovpavel@example.net,511574978
452,Софрон,Дьячков,2005-01-11,ОАЭ г. Черкесск бул. Пограничный д. 5 стр. 2/3 117534,longin_72@example.net,308825221
453,Влас,Денисова,2006-09-07,Белоруссия к. Краснокамск ш. Краснодарское д. 5/7 к. 2/6 649224,belozerovjanuari@example.org,Z10642956
454,Прасковья,Русаков,1958-07-08,Ямайка г. Зеленоград наб. Чкалова д. 9 к. 4 054720,wtimofeeva@example.net,881702282
455,Ананий,Мясникова,1989-05-11,Республика Корея п. Мончегорск ш. Болотное д. 72 к. 5/6 042592,pavlovolimpi@example.org,M17664685
456,Викентий,Горбунов,1946-11-10,Папуа п. Павловская ш. Геологов д. 2/9 450148,dorofeevamos@example.net,506848639
457,Бажен,Субботина,2002-01-27,Фиджи к. Апрелевка алл. Осенняя д. 493 стр. 933 419574,melnikovpolikarp@example.com,846009196
458,Нонна,Тарасова,1976-09-17,Венесуэла к. Екатеринбург ш. Высоцкого д. 5 стр. 33 523093,kovalevaanastasija@example.com,130989795
459,Антонина,Кулагин,1998-05-20,Замбия д. Ахтубинск наб. Заливная д. 39 стр. 110 697238,ruben_79@example.org,M59610267
460,Мартьян,Рогов,2014-07-05,Багамские Острова г. Меренга пр. Заливный д. 8 стр. 946 844002,muravevostap@example.net,W94591818
461,Мартьян,Бирюкова,2009-02-01,Камбоджа г. Камышин пр. Восточный д. 8/3 к. 6 292027,emil1983@example.net,396182901
