id,name,surname,birthday,address,email,passport
617,Аверьян,Меркушев,1968-07-11,Гренада г. Хоста бул. Веселый д. 11 к. 2/3 150479,vlas_1993@example.org,874252085
618,Евпраксия,Носкова,1945-06-06,Гватемала клх Чехов ш. Красноармейское д. 28 552989,bkononova@example.net,091224150
619,Татьяна,Щукина,1967-08-29,Сербия п. Белгород пр. Николаева д. 85 002176,artemi15@example.net,050353465
620,Аристарх,Князева,1979-09-26,Франция г. Ачинск пр. Октябрьский д. 8/2 стр. 262 174839,kallistrat1978@example.net,395704541
621,Фаина,Носова,1944-07-06,Саудовская Аравия с. Печора алл. Халтурина д. 62 стр. 5/1 183228,mechislav_2022@example.org,V25930077
622,Евдоким,Соболев,2009-01-31,Тринидад и Тобаго г. Котлас ш. Байкальское д. 6 к. 63 352913,anastasija_23@example.org,G16949791
623,Мокей,Доронина,2020-11-10,Болгария д. Королев ш. Коминтерна д. 6 к. 4 811276,vlasovirakli@example.org,Y43538340
624,Евсей,Лобанов,1958-10-24,Кипр клх Ревда (Сверд.) пр. Азовский д. 778 225092,esoboleva@example.net,675530729
625,Лукьян,Титов,1944-01-03,Коморы ст. Приозерск бул. Саратовский д. 20 355566,tvorimir70@example.org,764508867
626,Автоном,Шаров,1987-12-07,Афганистан с. Волгодонск пр. Чернышевского д. 27 597332,dementi_1988@example.net,404140608
627,Адриан,Филиппов,1979-02-24,Эритрея д. Стерлитамак алл. Советская д. 6/2 стр. 83 715199,filatovalora@example.com,655207913
628,Нестор,Соколова,1995-06-29,Бруней клх Липецк наб. Семашко д. 1/5 стр. 583 657951,moke_54@example.org,490866828
629,Бронислав,Федотов,1969-06-25,Мьянма к. Гусь-Хрустальный бул. Путевой д. 2/6 стр. 7 163419,valerija83@example.org,078629408
630,Агафон,Терентьева,1961-04-19,Босния и Герцеговина к. Ижевск пер. Тамбовский д. 6/4 к. 437 555939,vishnjakovvaleri@example.net,Y76580640
631,Авдей,Ермакова,1976-07-21,Маврикий к. Старый Оскол ул. Ленина д. 8 к. 6 832920,dorofe1983@example.com,073131529
632,Корнил,Баранов,1965-01-11,Республика Конго к. Эльбрус ш. Омское д. 49 016779,knjazevaanna@example.net,523534030
633,Исай,Щукина,2007-04-26,Габон г. Новая Игирма пр. Майский д. 5/6 290873,fedosi1990@example.org,317114127
634,Филимон,Савина,1992-01-20,Гамбия д. Серпухов пр. Карла Маркса д. 513 стр. 4/9 122820,jakovshashkov@example.org,O06346449
635,Куприян,Сидоров,1955-01-04,Венгрия с. Тотьма пр. Гайдара д. 1 404416,avtonom_66@example.org,386551582
636,Савва,Гаврилов,1973-07-28,Демократическая Республика Конго к. Мценск пер. Энгельса д. 6 к. 1 481982,irina25@example.com,U96145244
637,Ангелина,Денисов,1979-12-17,ОАЭ к. Забайкальск пр. Шмидта д. 3 955902,jakubrusakov@example.com,361645691
638,Леонид,Ильина,2007-10-09,Лесото клх Сарапул ш. Запрудное д. 38 стр. 3/3 120646,pankrati2024@example.com,199283444
639,Аггей,Крюкова,1965-02-18,Турция д. Терней бул. Строителей д. 740 стр. 869 281888,emeljan_13@example.org,K06083567
640,Дорофей,Федорова,1976-12-07,Восточный Тимор клх Калевала ул. Курская д. 3 к. 80 459586,rkudrjavtseva@example.net,N32482398
641,Самуил,Афанасьев,2019-09-23,Таиланд п. Зеленоград бул. Монтажников д. 823 066288,pimen1981@example.org,I68940561
642,Ермил,Меркушев,2017-12-30,Кипр г. Асбест ул. Сибирская д. 9/3 к. 9 792294,elizaveta2000@example.net,D00914684
643,Севастьян,Горбунов,1998-04-23,Нигерия с. Балашов бул. Фестивальный д. 902 768322,mjasnikovaleksandr@example.org,A20309947
644,Пантелеймон,Селезнева,1956-09-26,Сербия г. Майкоп пер. Дорожный д. 9 к. 267 618277,vorontsovadarja@example.org,Y30616634
645,Фортунат,Тимофеева,2019-09-11,Монако к. Одинцово бул. Морозова д. 9 217458,luka54@example.org,245930929
646,Творимир,Сысоева,1958-03-01,Вануату д. Петропавловск-Камчатский алл. Толстого д. 8 к. 3 663693,evdokija_14@example.com,962980641
647,Богдан,Крюков,2013-07-07,Джибути клх Сорочинск ул. Производственная д. 517 604166,pestovkarl@example.net,865617022
648,Юлия,Быкова,1945-10-14,Сент-Винсент и Гренадины д. Гаврилов-Ям ул. Культуры д. 77 стр. 3 781876,burovaalevtina@example.net,V79255872
649,Лаврентий,Савин,1956-10-13,Кения ст. Эльбрус ш. Макаренко д. 1 стр. 5/9 577544,feliks82@example.com,828783381
650,Андрей,Артемьева,1978-08-13,Восточный Тимор д. Троицк (Моск.) пер. Ленинский д. 671 к. 5 200513,ljubomiralekseev@example.org,706377225
651,Януарий,Титова,2007-01-15,Соломоновы Острова клх Кудымкар ул. Коммунаров д. 11 к. 9 834935,tamara_1972@example.com,G45547550
652,Ираида,Жукова,1966-10-18,Украина г. Славянск-на-Кубани ул. ДОС д. 8/7 297575,stepanovarefi@example.com,377626349
653,Феликс,Шилова,1954-09-24,Испания клх Нарткала пер. Революционный д. 3/9 631599,lev2014@example.com,402250422
654,Наркис,Щербакова,1998-11-24,Монголия с. Чегем бул. Фрунзе д. 402 к. 698 809097,fedosikulagin@example.com,568017602
655,Пимен,Петухова,1955-08-12,Самоа клх Углегорск пер. Воровского д. 4/3 912612,chernovarkadi@example.org,562819204
656,Елизар,Костин,1984-09-20,Люксембург с. Ржев пер. Алтайский д. 850 к. 7/9 284277,fedorovaivanna@example.com,275361157
657,Октябрина,Григорьева,1985-02-24,Люксембург клх Моршанск пр. Медицинский д. 207 к. 60 879444,valerija34@example.net,L25747341
658,Аркадий,Киселев,1950-09-21,Ливия клх Ярославль ул. Заливная д. 4 388916,modest1978@example.net,158875354
659,Софрон,Ефимова,1975-03-25,Пакистан к. Тында пр. Гафури д. 585 стр. 477 617996,kliment_07@example.org,C65241556
660,Фома,Михайлова,1998-07-09,Ирландия д. Калязин пр. Ручейный д. 3 885211,kignatov@example.org,S26818087
661,Флорентин,Новикова,2007-01-27,Центральноафриканская Республика г. Переславль-Залесский пер. Папанина д. 24 858035,zinovi1998@example.net,H71735920
662,Артемий,Медведева,1950-07-19,Черногория ст. Валдай ш. Сурикова д. 97 стр. 99 344217,avdeevadrian@example.org,310541170
663,Мартьян,Николаева,1981-05-27,Малайзия г. Кетченеры алл. Матросова д. 4 к. 13 051754,denisovarseni@example.com,R51096755
664,Аникита,Доронин,2020-05-23,Швеция д. Яшкуль алл. Островского д. 3/8 к. 85 084097,mihailbelozerov@example.com,N78594374
665,Венедикт,Трофимова,1944-10-07,Эфиопия к. Камень-на-Оби ш. Геологов д. 1/8 стр. 575 544432,grishinapelageja@example.com,T12391459
666,Христофор,Чернова,1995-10-14,Суринам клх Белокуриха пер. Путевой д. 106 598079,viktorin_2020@example.org,B90759907
667,Семен,Шашкова,1950-12-25,Камерун п. Советский бул. Тульский д. 1/7 стр. 4/5 985618,anisim1995@example.net,H96234099
668,Давыд,Лихачев,1956-10-20,Мальдивы к. Псков пр. Разина д. 5 286825,sergejudin@example.org,D68956105
669,Азарий,Тихонов,2003-02-09,Кипр п. Абакан ул. Красногвардейская д. 119 стр. 73 046323,knjazevakira@example.org,117895150
670,Ия,Комиссарова,1946-05-08,Бразилия п. Ардон пр. Волкова д. 2 к. 9 492960,fominaelizaveta@example.com,D89540715
671,Анатолий,Сысоева,2012-11-29,Словения д. Сыктывкар пер. Максима Горького д. 1/3 стр. 14 571862,ostromir33@example.org,905078308
672,Олимпиада,Артемьев,1989-11-24,Кения ст. Суздаль алл. Папанина д. 3/7 стр. 9/8 240107,gorde_1992@example.com,N84010562
673,Милица,Тетерин,1992-04-14,Гаити ст. Петушки пр. Красных Партизан д. 817 к. 76 148045,qorlova@example.com,544004175
674,Ярослав,Кудряшова,1965-03-09,Эквадор клх Буйнакск пр. Петровский д. 895 587843,kasjan_2016@example.org,437846637
675,Якуб,Игнатьева,1972-02-27,Панама п. Тулпан пр. Льва Толстого д. 91 стр. 5 107972,pavelteterin@example.org,028042340
676,Прохор,Ковалева,1995-01-17,Польша клх Саратов бул. Щетинкина д. 1 к. 2/3 168366,faina_31@example.com,D83483535
677,Демьян,Князев,1949-08-10,КНДР к. Сарапул наб. Литейная д. 55 916506,bkornilov@example.com,600526748
678,Ермолай,Казакова,2012-10-24,Литва д. Юрюзань наб. Локомотивная д. 7 стр. 3 591740,pestovvseslav@example.com,238870822
679,Тимур,Марков,1953-06-17,ЮАР п. Ахтубинск бул. Станиславского д. 8/2 к. 4/7 456824,rodionovaalevtina@example.org,W83822813
680,Матвей,Михайлова,1965-03-13,Португалия к. Миллерово ш. Береговое д. 877 к. 8/4 448764,elizar_90@example.com,710249615
681,Мартын,Игнатов,2006-09-29,Бельгия г. Слюдянка бул. Гагарина д. 315 стр. 97 221842,dorofesidorov@example.com,446076657
682,Таисия,Колесникова,1966-09-20,Гвинея д. Ельня ул. Геологическая д. 7 439861,zinovi1991@example.org,J67149729
683,Милен,Прохоров,1986-02-14,Россия к. Армавир ш. Папанина д. 837 785897,zinovi1980@example.com,770853384
684,Прокофий,Панфилова,1968-12-17,Белиз клх Мыс Шмидта алл. Мирная д. 2 к. 53 961490,tsvetkovvatslav@example.org,L40740764
685,Герман,Давыдов,2017-02-08,Руанда клх Печенга алл. Горная д. 7/4 стр. 26 687454,savelevnarkis@example.org,Y06852507
686,Федот,Титов,1973-07-01,Австралия г. Вязьма бул. Энергетический д. 239 736106,izjaslav2012@example.org,G62192176
687,Ипполит,Мельников,2005-12-04,КНДР д. Нефтеюганск ш. 8 Марта д. 19 729081,mamontovelise@example.com,Q41473179
688,Роман,Воронцов,1945-09-12,Гаити клх Нерчинск алл. Кузнечная д. 43 стр. 2/5 078448,iosif1988@example.net,O17734305
689,Мариан,Красильникова,1987-07-15,Суринам ст. Кашхатау ш. Целинное д. 843 к. 14 273593,varlaamburov@example.com,V51201528
690,Лавр,Турова,2017-12-14,Ирак с. Казань бул. Карла Маркса д. 270 860847,prokl_07@example.org,544412904
691,Лавр,Игнатьева,1966-06-21,Сан-Томе и Принсипи п. Белореченск пер. Тульский д. 12 стр. 58 015268,lebedevaverki@example.net,199032534
692,Севастьян,Шилова,2001-06-05,Уганда с. Златоуст ш. Кавказское д. 2 к. 49 392829,kononkiselev@example.com,201628443
693,Рюрик,Юдин,1957-10-24,Словакия д. Пышма ул. Большая д. 9/9 к. 179 696830,artemevsidor@example.net,D16722702
694,Анжела,Кондратьев,1954-11-25,Марокко п. Печенга бул. Пригородный д. 5 446884,harlampi_1993@example.net,R75388998
695,Любосмысл,Васильев,1978-06-27,Фиджи г. Кызыл наб. Белорусская д. 9 454895,vladilenkrasilnikov@example.org,C24870010
696,Нифонт,Крылов,1979-06-19,Науру клх Саров (Морд.) ш. Щорса д. 20 стр. 6 729653,belousovsofron@example.net,993791272
697,Митофан,Фадеева,1988-08-23,Мавритания к. Губкин пер. Докучаева д. 125 к. 8/2 651373,nikiforovratibor@example.net,F46979623
698,Ипат,Федосеев,1949-01-07,Пакистан с. Раменское ш. Станиславского д. 1 316600,sobolevaleksandr@example.net,354777054
699,Октябрина,Стрелкова,1943-10-03,Сирия ст. Курчатов алл. Смоленская д. 9/8 к. 386 136855,ipatdmitriev@example.net,G37391281
700,Соломон,Тарасов,2004-03-19,Сингапур г. Качканар ш. Советское д. 42 стр. 561 336442,isa_1980@example.com,744710035
701,Будимир,Емельянова,1979-12-21,Шри-Ланка клх Игнашино ш. Родниковое д. 38 к. 3/4 543870,zahar_00@example.net,Y61243047
702,Варлаам,Стрелков,2019-02-05,Нидерланды г. Краснокамск бул. Украинский д. 87 821067,zdenisova@example.net,T49014295
703,Юлия,Яковлев,2011-06-24,Иран д. Усть-Катав ш. Герцена д. 61 396918,trofimovleonti@example.com,V60894024
704,Ким,Шестаков,2014-01-22,Алжир д. Серпухов ш. Черемуховое д. 2 стр. 27 110219,elizarvasilev@example.com,840881239
705,Болеслав,Антонов,2005-09-14,Мали к. Биробиджан наб. Полярная д. 5/7 стр. 61 208964,emuhin@example.net,400306840
706,Творимир,Костина,1963-07-25,Индия с. Вытегра пр. Рабочий д. 29 к. 824 929045,kopilovagafon@example.net,326695861
707,Прокл,Исаков,1947-03-31,Сальвадор п. Алдан алл. Путейская д. 911 стр. 5/8 473147,mamontovveniamin@example.org,T03863270
708,Артемий,Матвеева,1995-12-04,Лаос г. Звенигород бул. Олимпийский д. 83 785963,litkinatatjana@example.net,204745369
709,Сигизмунд,Калашникова,2005-10-11,Литва д. Соболево ул. Большевистская д. 1 стр. 5 745028,filipp1983@example.org,746291858
710,Майя,Быкова,2009-06-30,Иордания д. Тула пер. Красных Партизан д. 973 940842,varfolome68@example.org,904914669
711,Викторин,Журавлев,1977-09-20,Уганда клх Хасавюрт ш. Кирова д. 945 к. 475 747069,kolesnikovairaida@example.org,B06616839
712,Роман,Корнилова,1989-06-03,Парагвай г. Тобольск бул. Революции д. 1/8 к. 2 068890,nvladimirova@example.org,441227821
713,Макар,Пестова,1951-08-11,Самоа с. Середниково пр. Химиков д. 61 к. 481 050524,filaret_1990@example.com,R82232261
714,Александра,Рогова,1970-07-27,Южный Судан п. Заводоуковск бул. Надежды д. 255 стр. 7/8 152198,valentin1991@example.com,A52372280
715,Варвара,Анисимова,1974-11-25,Тринидад и Тобаго к. Салехард пр. Уральский д. 562 к. 6 808855,sitnikovporfiri@example.org,T67558664
716,Фирс,Потапова,1979-08-08,Уругвай п. Палана пер. Урицкого д. 94 к. 9/7 619818,marija_2023@example.net,743171876
717,Всеволод,Кулагин,1981-01-29,Ирландия клх Плес бул. Свердлова д. 883 стр. 8 724657,vera_07@example.com,962050245
718,Федор,Никонова,1988-07-12,Ямайка к. Касимов алл. 8-е Марта д. 34 585823,jlazareva@example.org,905545844
719,Михей,Горбачев,2006-04-26,Малайзия с. Кабанск алл. Кочубея д. 25 к. 45 177113,jaroslav_1991@example.com,A29506076
720,Антип,Силин,2004-02-23,Болгария д. Артем бул. Дзержинского д. 7 стр. 8/8 609681,sitnikovaristarh@example.net,O03046184
721,Модест,Сорокин,2004-10-12,Ангола клх Плесецк наб. Нефтяников д. 577 стр. 2 894693,evstafi_97@example.com,538261082
722,Сергей,Кононов,1997-01-13,Уганда д. Аргаяш алл. Фабричная д. 3/9 к. 6/5 723138,askold_1998@example.net,409601958
723,Нифонт,Алексеев,1966-11-11,Южный Судан клх Юрьев-Польский бул. Элеваторный д. 6 стр. 1/9 906914,nikola_2017@example.net,Z34116760
724,Викторин,Комиссарова,1947-09-06,ЮАР с. Кунгур пр. Коммуны д. 3 564783,naina78@example.net,723249073
725,Майя,Филатов,1986-11-12,Зимбабве г. Видное ул. Широкая д. 262 947047,belousovvelimir@example.com,E26132681
726,Селиверст,Евсеев,1992-02-21,Науру к. Серебряные Пруды пер. Садовый д. 99 481172,arhip35@example.net,058795096
727,Людмила,Кириллова,1944-12-21,Перу д. Ельня алл. Рылеева д. 52 к. 9 269068,nadezhda86@example.com,599185632
728,Вышеслав,Федосеев,1974-02-04,Перу клх Сальск пр. Осенний д. 5 стр. 2 558445,boris_1989@example.com,789014776
729,Зиновий,Муравьев,1944-12-22,Латвия ст. Владивосток ш. Гвардейское д. 2 к. 77 009445,ushubina@example.net,716204540
730,Касьян,Лихачева,1999-07-16,Турция ст. Чита наб. Димитрова д. 5/3 к. 2/3 097576,leontimihalov@example.com,963348348
731,Христофор,Горшков,2008-01-30,Словения г. Арзамас бул. Курганный д. 8/4 к. 7 235288,popovhariton@example.net,Z21833049
732,Анна,Бобылева,1963-11-19,Намибия г. Кунгур наб. Рылеева д. 29 217776,eduard_1971@example.org,488109612
733,Полина,Блинов,2017-12-11,Румыния п. Псков ул. Почтовая д. 8 к. 8/7 988450,fedor1995@example.com,R36300651
734,Валерьян,Зуева,1953-08-09,Малайзия г. Кемерово ул. Специалистов д. 86 к. 79 752687,elise09@example.net,040093831
735,Андроник,Авдеева,1951-12-09,Сан-Марино клх Кулунда пер. Строителей д. 75 531188,makarovakira@example.org,210113938
736,Кира,Носков,1982-04-03,Бурунди д. Новороссийка наб. Смирнова д. 4/9 стр. 2/6 631531,harlampi_88@example.net,V61129813
737,София,Моисеева,1987-10-02,Польша г. Вологда пр. Нижний д. 8/9 504818,antonin27@example.org,P22842646
738,Иннокентий,Алексеева,2002-10-15,Сан-Марино г. Липецк ул. Целинная д. 7/4 к. 1 549732,trifonprohorov@example.net,129594982
739,Всеслав,Шилов,1985-05-17,Маршалловы Острова клх Змеиногорск пр. Ленина д. 811 735175,nekrasovadam@example.org,O38129508
740,Назар,Шарова,2011-01-08,Вануату п. Хабаровск ул. Кленовая д. 38 692858,denis62@example.org,J48403383
741,Болеслав,Пономарева,2022-11-05,Ирак клх Азов (Рост.) пер. Сурикова д. 65 464264,velimirkulagin@example.net,336051699
742,Герман,Федотова,2002-12-24,Белиз к. Карпинск пр. О.Кошевого д. 8 к. 57 471071,pankratkolobov@example.com,749262862
743,Орест,Зуева,1946-06-26,Центральноафриканская Республика ст. Грозный ул. Громова д. 3/2 к. 8 128636,bojanafanasev@example.com,P59118429
744,Варфоломей,Константинов,1990-08-03,Нидерланды д. Россошь ул. Карьерная д. 883 стр. 727 766258,zatsevemil@example.org,173254781
745,Станимир,Кузнецов,1965-06-04,Федеративные Штаты Микронезии к. Тулун ул. 50 лет Октября д. 70 стр. 351 188277,korolevaoksana@example.net,108724343
746,Элеонора,Мясников,2014-12-10,Маврикий г. Листвянка (Иркут.) пер. Гастелло д. 32 стр. 1/9 893779,mstislav_35@example.net,M28018409
747,Филимон,Бирюков,1968-05-31,Новая Зеландия к. Агата наб. К.Маркса д. 98 998458,sidorovvladlen@example.org,214303986
748,Алина,Кулагин,1976-08-14,Болгария к. Инта алл. Загородная д. 6 к. 684 157461,agafon_44@example.net,I63186215
749,Януарий,Игнатьев,1969-04-28,Антигуа и Барбуда ст. Беломорск наб. Урожайная д. 59 658980,larisa_58@example.org,773658306
750,Ким,Андреева,1983-12-02,Норвегия клх Ельня ш. Семашко д. 7 стр. 2 498175,vseslav_1983@example.net,259964156
751,Амос,Панфилов,1955-12-15,Парагвай п. Орел пр. Мая 1 д. 700 к. 84 730956,apollonvladimirov@example.com,312538699
752,Тамара,Шестакова,2016-10-23,Монако клх Домбай наб. Чехова д. 9/1 стр. 8 671150,rjabovaagafja@example.com,X17343603
753,Ладислав,Титова,2006-02-28,Польша с. Бавлы бул. Новосельский д. 3/7 стр. 64 424937,frol24@example.com,Y97861227
754,Сергей,Аксенов,1944-10-05,Науру п. Элиста пер. Речной д. 2/5 к. 87 136697,serge_2003@example.org,W94134146
755,Акулина,Белова,2012-11-15,Иран ст. Эльтон наб. Куйбышева д. 5 541908,dorofeevernest@example.org,830999926
756,Анжелика,Мишин,1963-02-07,Польша к. Кондопога алл. Курская д. 39 к. 2/6 197404,timofeevmefodi@example.com,451174452
757,Корнил,Селиверстов,1989-05-13,Иордания г. Миллерово алл. Рыбацкая д. 77 к. 63 055687,klavdi_80@example.org,U88094692
758,Каллистрат,Калинин,1947-05-12,Эквадор п. Тикси наб. Новостройка д. 54 062662,arseni_2002@example.com,087238945
759,Руслан,Трофимова,2002-06-05,Таиланд с. Усолье Сибирское пер. 50 лет ВЛКСМ д. 4/8 к. 26 881853,lapinaalina@example.org,O07841575
760,Алла,Гущина,1958-09-02,Боливия к. Нарткала алл. Новая д. 768 к. 7 334642,ymerkushev@example.com,178631051
761,Аникей,Носков,1968-08-12,Болгария клх Миасс пер. Дальний д. 716 959456,zaharovsaveli@example.org,738691915
762,Евгения,Лаврентьева,2003-04-10,Исландия ст. Сургут (Хант.) ул. К.Маркса д. 857 стр. 5 471246,ernestfedoseev@example.net,V31641850
763,Эраст,Галкина,2014-05-12,Лихтенштейн с. Ребриха пр. З.Космодемьянской д. 3 стр. 757 711228,evstafi2019@example.com,H29057509
764,Мокей,Мамонтов,2007-01-04,Барбадос клх Аша ш. 50 лет ВЛКСМ д. 4/3 725977,vitali1973@example.com,569146769
765,Зоя,Бобылева,1958-03-18,Сан-Томе и Принсипи д. Гудермес ш. Юности д. 782 стр. 99 127007,nazarovvladimir@example.org,A44344391
766,Селиверст,Герасимов,1970-07-25,Узбекистан п. Чулым алл. Луначарского д. 9 стр. 641 039213,pantelemon76@example.com,395194336
767,Бажен,Тетерина,2013-05-08,Турция к. Кириши ш. Поселковое д. 33 к. 43 329677,stojan83@example.net,N77862645
768,Алевтина,Шарова,1979-09-15,Республика Корея п. Златоуст пр. Седова д. 595 645978,samson14@example.com,865739256
769,Фрол,Исаев,2002-11-05,Сент-Винсент и Гренадины п. Кизел ш. Зеленое д. 2 091366,ihohlova@example.com,X31513755
770,Галактион,Константинова,1956-09-28,Сенегал ст. Сургут (Хант.) ш. ДОС д. 617 122706,gerasim62@example.org,187898646
771,Кирилл,Корнилова,1985-02-03,Египет д. Крымск наб. Первомайская д. 6 к. 9 610682,merkushevmarian@example.org,J64069045
772,Всемил,Гуляева,2009-12-31,Грузия п. Буйнакск алл. Свердлова д. 3/1 228030,petr_79@example.com,461815494
