id,name,surname,birthday,address,email,passport
462,Фирс,Дьячков,1982-05-04,Коморы клх Медногорск пер. Герцена д. 93 стр. 465 346373,ustinharitonov@example.org,650076906
463,Еремей,Голубев,1993-12-10,Саудовская Аравия к. Каспийск пер. Таежный д. 3/4 273305,belovzahar@example.org,O80873260
464,Прокл,Комиссаров,2010-03-18,Вануату с. Певек наб. Торговая д. 77 стр. 771 161609,ivanna_1978@example.org,448944367
465,Нина,Фролова,1952-03-20,Сингапур г. Воркута алл. Полярная д. 6 457624,vasilikuzmin@example.org,S04889388
466,Светозар,Шаров,1946-10-15,Египет ст. Усть-Баргузин ул. Островского д. 743 к. 3/7 725019,radislavmatveev@example.net,Z22017486
467,Артем,Дмитриева,1965-05-22,Мексика ст. Находка пр. Черемушки д. 3 890791,bartemeva@example.org,G63262416
468,Елисей,Васильева,1971-10-15,Северная Македония г. Усолье Сибирское наб. Магистральная д. 6 314202,alevtina_80@example.net,459174541
469,Борислав,Горбачев,2006-02-14,Южный Судан п. Ачинск наб. Азина д. 690 стр. 704 658749,pankrati16@example.net,M19421338
470,Анна,Тихонов,1959-01-13,Украина клх Кострома ш. Бажова д. 2 стр. 945 608761,luchezar2010@example.net,878217326
471,Алексей,Гусева,2013-10-28,Узбекистан с. Назрань ш. Владимирское д. 731 стр. 6 935396,guljaevtihon@example.com,267500490
472,Панфил,Тимофеев,2022-01-15,Гватемала д. Можга пр. Рыбацкий д. 232 стр. 8 719032,jansidorov@example.net,312170894
473,Ювеналий,Данилов,2020-05-19,Ливия с. Асбест пер. Фурманова д. 4 к. 5 279953,agafonovsvetozar@example.org,687226344
474,Николай,Маслова,1976-07-30,Республика Конго клх Мичуринск пер. Поселковый д. 3 стр. 7 463092,bespalovarhip@example.org,737285757
475,Леон,Соколов,1961-06-14,Куба г. Гусь-Хрустальный ул. Путевая д. 2 стр. 240 228281,ratmir43@example.com,W54056505
476,Анна,Давыдов,2000-09-17,Центральноафриканская Республика п. Лесной (Сверд.) наб. Промышленная д. 5/1 806273,ippolit2009@example.net,Z54944920
477,Андрон,Воронцова,2002-05-19,Сенегал к. Магадан наб. Флотская д. 2 стр. 7 455168,kazimirmarkov@example.com,721236319
478,Аггей,Соловьев,1976-12-06,Самоа к. Клин наб. Республиканская д. 501 841267,shubinfilimon@example.com,058638641
479,Елена,Белов,1968-05-30,Йемен г. Армавир ул. Песочная д. 9/4 к. 1 926496,naumovavalentina@example.org,F14213045
480,Прасковья,Щукина,1944-02-19,Того к. Билибино ул. Просвещения д. 128 к. 978 488225,oksana1970@example.net,X86738599
481,Назар,Романова,1949-01-29,Израиль клх Валдай ш. Транспортное д. 8 922516,kondrat_1999@example.com,H55046791
482,Вера,Носов,1970-12-14,Эритрея д. Южно-Курильск ул. Лесхозная д. 764 279776,rtihonov@example.org,E09780237
483,Изот,Корнилов,1957-11-24,Нигерия ст. Агата пр. Мелиораторов д. 411 к. 54 497178,vladimiremeljanov@example.com,K37225065
484,Милица,Ефремов,2022-04-08,Гондурас к. Тарко-Сале наб. Механическая д. 7/5 775472,azari86@example.org,941340008
485,Ян,Носкова,1976-08-07,Габон к. Новый Уренгой пр. Привольный д. 921 100678,potap1987@example.org,146245467
486,Гурий,Макаров,2013-10-25,Азербайджан клх Усть-Ордынский пр. Родниковый д. 4/9 стр. 73 745264,fedotovereme@example.org,750007405
487,Ульян,Симонова,1945-09-18,Египет с. Лазаревское наб. Волгоградская д. 2/8 стр. 413 905201,viktorin33@example.org,W75300860
488,Капитон,Логинов,2007-07-05,Никарагуа д. Кетченеры пр. Дружба д. 5/9 к. 1 065553,zhukovfoka@example.net,285413403
489,Мстислав,Комиссарова,1968-10-23,Коста-Рика с. Аша ул. Металлистов д. 1/7 к. 7/9 371230,ustinsmirnov@example.net,K92625240
490,Болеслав,Туров,1983-01-06,Мавритания клх Устюжна ул. Космодемьянской д. 579 к. 448 701709,iraida2008@example.com,G24698232
491,Лариса,Родионова,2023-05-21,Габон с. Александров Гай пр. Новосельский д. 3 879770,larisa_71@example.com,359290746
492,Валерия,Петухова,2001-01-19,Кабо-Верде к. Югорск ул. Союзная д. 933 к. 37 161344,harlampibeljakov@example.net,013010162
493,Алина,Белозерова,1980-01-06,Черногория д. Волхов бул. Одесский д. 5 912547,nikodim_10@example.net,X03027530
494,Ярослав,Бобров,1952-04-18,Гвинея клх Чита ул. Торговая д. 996 648022,volkovaangelina@example.org,O98635516
495,Евграф,Самсонов,1999-01-11,Узбекистан с. Темрюк пр. Халтурина д. 8 к. 8 961858,antip_78@example.net,S45883120
496,Вячеслав,Волков,1995-03-29,Южный Судан г. Шадринск бул. Медицинский д. 4/1 к. 9/7 570545,sidor65@example.com,S24268883
497,Виссарион,Лобанова,2012-05-02,Румыния д. Оленек пр. Толстого д. 28 стр. 7/7 606812,kulaginantonin@example.com,180287099
498,Гедеон,Шаров,1950-05-12,Бангладеш д. Юрьевец (Иван.) пер. Короленко д. 29 199507,ostap1995@example.net,180326281
499,Добромысл,Алексеев,2023-08-13,Сент-Люсия д. Новомосковск пер. Володарского д. 1 к. 682 082955,zinovevalidija@example.org,Y06909011
500,Силантий,Одинцова,1981-09-24,Кипр клх Аша пер. Достоевского д. 513 стр. 9/9 995561,ivan51@example.net,431692758
501,Глафира,Гордеева,1985-11-26,Уругвай г. Томпа пр. Партизанский д. 5/8 768770,sandreev@example.net,O77037738
502,Никита,Борисов,1955-07-01,Непал с. Красноуральск ш. Морское д. 8 к. 9 017326,ruslan62@example.org,B49176733
503,Никита,Романова,2009-10-31,Кот-д’Ивуар п. Петропавловск-Камчатский пр. Свободы д. 697 стр. 7/5 977714,kondratipanov@example.net,268646711
504,Наркис,Ефимов,2000-04-14,Мадагаскар клх Пенза пер. Ушакова д. 4 585614,zinaida66@example.com,566653930
505,Август,Кулаков,1956-06-05,Панама ст. Москва МГУ пр. Льва Толстого д. 802 стр. 602 098551,ladimir88@example.com,Q82842310
506,Моисей,Щербакова,1958-12-16,Бенин с. Кудымкар наб. Тюленина д. 439 стр. 3 825426,gorbunovaanzhela@example.com,D66782910
507,Мефодий,Быкова,2008-02-21,Джибути п. Владивосток ул. Р.Люксембург д. 2/9 к. 7 511754,andreevparamon@example.com,T15255519
508,Севастьян,Федотова,1944-03-11,Судан клх Магадан пер. Геологический д. 2/4 060031,evdokija89@example.com,029847256
509,Софон,Третьяков,2003-04-25,Демократическая Республика Конго клх Лабинск бул. Полтавский д. 4 045267,svetlana58@example.org,935171917
510,Марфа,Рожков,1965-02-10,Ангола с. Нарткала бул. Белорусский д. 40 871967,gerasimovzinovi@example.org,209116738
511,Трофим,Блинова,1983-03-20,Мальта клх Нальчик ул. Пригородная д. 9 к. 25 658040,semenvladimirov@example.com,Z23208287
512,Ксения,Осипова,2018-11-21,Коста-Рика клх Кинешма наб. Менделеева д. 9/4 стр. 46 889291,gerasimovamaja@example.org,644257103
513,Емельян,Бирюкова,2017-10-20,Сомали клх Камень-на-Оби пер. Карла Маркса д. 94 к. 6 745295,arseni32@example.net,163070775
514,Евдоким,Константинова,1984-04-30,Северная Македония г. Орехово-Зуево наб. Привокзальная д. 1 к. 8/4 825109,smoiseev@example.net,M02166506
515,Михей,Сидорова,1984-07-05,Чили клх Абакан пер. Марта 8 д. 77 524682,gerasim1995@example.com,798088041
516,Тихон,Большакова,2013-08-02,Гамбия с. Бугульма пр. Ульяновский д. 3 187827,tihon_2011@example.org,Y74783721
517,Елена,Андреева,2004-05-17,Венгрия г. Междуреченский бул. Ясный д. 577 к. 266 930761,bespalovsamson@example.org,Z30865644
518,Орест,Кошелев,1976-07-18,Кувейт г. Орел наб. Ясная д. 39 к. 4/5 731352,isaeliseev@example.org,113467292
519,Гурий,Белозеров,1973-10-08,Ямайка ст. Пушкино (Моск.) пер. Фестивальный д. 21 074152,maja1971@example.org,P21759582
520,Петр,Юдин,2015-08-27,Армения к. Шатура ш. Циолковского д. 9 к. 2 225069,hohlovnikifor@example.com,P80319122
521,Андрон,Белозерова,1977-02-21,Науру п. Великий Устюг ш. Победа д. 4 стр. 97 389691,ljubov_42@example.net,Z07923979
522,Иван,Зайцев,2001-08-16,Чили клх Шатой пр. Чайкиной д. 328 045258,lazarevjuri@example.net,O50906309
523,Никандр,Савельев,1958-04-24,Венгрия клх Кырен наб. Ленинская д. 45 924106,ivanovkazimir@example.com,J73196407
524,Ефим,Зиновьев,2017-01-30,Мозамбик д. Апрелевка ш. Иванова д. 514 к. 7/2 129269,gushchinvitali@example.net,N14773137
525,Ерофей,Тимофеев,1949-11-20,Кирибати к. Киренск пер. Металлургов д. 193 961622,pankrat_2018@example.net,T30424221
526,Александр,Васильева,1976-11-12,Барбадос п. Кудымкар алл. Коминтерна д. 1 к. 5 796961,bikovizot@example.com,271326526
527,Эмиль,Осипов,1997-02-09,Ирак клх Калининград пр. Крымский д. 94 к. 7 160341,drozdovaksenija@example.com,H46147581
528,Давыд,Федорова,1960-04-07,Мальта ст. Анива ш. Литейное д. 85 234292,ermil69@example.com,389087834
529,Чеслав,Яковлева,1977-10-25,Гамбия д. Мурманск ул. Депутатская д. 898 374815,serafim_1979@example.com,A84362198
530,Осип,Емельянова,1974-06-05,Гайана д. Тулун наб. Ручейная д. 46 к. 3/6 333526,lora27@example.com,673042588
531,Лидия,Михайлов,1949-09-08,Мальдивы к. Черняховск алл. Мельничная д. 39 843100,solomon2023@example.net,382273424
532,Панкратий,Пономарева,1993-07-17,Сербия клх Плес пр. Победа д. 694 к. 60 819028,kondrati96@example.net,834996174
533,Алевтина,Буров,1958-07-03,Словакия с. Токма бул. Первомайский д. 3/2 к. 661 708330,danilablinov@example.com,446693870
534,Демьян,Капустина,2019-02-16,Таджикистан г. Октябрьский (Башк.) алл. Приозерная д. 1 стр. 755 849214,fortunatshashkov@example.org,864575953
535,Зосима,Степанов,2010-09-21,Венгрия ст. Кострома ул. Слободская д. 978 стр. 5 795457,anna1990@example.org,349695118
536,Гремислав,Беляев,1947-12-12,Филиппины д. Нефтегорск (Самар.) алл. Загородная д. 55 стр. 8 415293,gromovboris@example.org,F12149010
537,Ермил,Матвеева,2016-08-07,Белиз п. Гремячинск (Перм.) пр. Торговый д. 590 649606,isaevanike@example.com,Z72959043
538,Софрон,Меркушева,1978-11-14,Мозамбик ст. Галич ул. Орджоникидзе д. 2/4 стр. 7/8 735788,novikovagalina@example.org,D47306292
539,Анастасия,Наумов,2002-02-22,Ангола д. Верхоянск наб. Запрудная д. 26 стр. 6/6 978247,urjabov@example.net,362784383
540,Родион,Костин,1950-10-03,Сальвадор д. Павловская пер. М.Горького д. 7 к. 6/2 598009,velimir1982@example.org,Y12965708
541,Станимир,Хохлов,1973-07-21,Лихтенштейн п. Бологое наб. Учительская д. 103 к. 5 514868,kudrjavtsevantip@example.net,953793380
542,Константин,Баранова,2010-10-14,Буркина-Фасо г. Долинск алл. Ростовская д. 820 315546,ljudmila_1999@example.org,421995036
543,Александра,Блохин,2006-08-07,Лесото д. Химки пр. Черноморский д. 6 к. 8 847578,tretjakovdavid@example.org,338228400
544,Трифон,Туров,1975-02-14,Туркмения п. Александров бул. Ломоносова д. 8 996700,vitali_2014@example.com,G56511986
545,Викентий,Пахомова,2018-07-21,Узбекистан к. Яшкуль алл. Песочная д. 7/4 904910,konstantin76@example.net,819685228
546,Галактион,Молчанова,1983-10-02,Греция с. Сухиничи наб. Макаренко д. 35 к. 6/3 946591,borislav_1993@example.org,274939567
547,Валентин,Соболев,2012-04-07,Восточный Тимор г. Аргаяш пер. Вахитова д. 26 к. 398 110088,idmitrieva@example.org,243495038
548,Феврония,Кудряшова,1949-09-14,Латвия к. Александров Гай ул. Юности д. 11 стр. 953 489270,kudrjavtsevdementi@example.com,448935426
549,Гедеон,Карпов,2022-08-19,Вануату клх Карпинск пер. Серафимовича д. 6/5 стр. 7 663201,arkadi1982@example.org,X74158971
550,Лукьян,Белов,1995-07-09,Мальдивы ст. Черемхово пер. Терешковой д. 93 к. 63 358054,andron_48@example.com,X02941632
551,Алла,Соколов,1979-05-17,Италия ст. Грозный ул. Осенняя д. 2 к. 755 661187,filimon_1976@example.org,N05155731
552,Амвросий,Зыкова,1989-03-06,Кения с. Макушино пер. Тенистый д. 51 157164,valentin_03@example.com,549306189
553,Потап,Большаков,1971-01-15,Сингапур клх Тулун бул. М.Горького д. 9 125041,sigizmundbeljaev@example.net,X71841968
554,Валентина,Щукин,1976-04-28,Эфиопия к. Вуктыл наб. Орджоникидзе д. 730 к. 5/5 335447,milen_1988@example.org,C44367292
555,Ираклий,Богданов,1948-04-29,Эквадор ст. Жиганск ул. Ульяновская д. 168 стр. 8 248279,oksana_2022@example.org,X22815717
556,Зосима,Калинина,1960-01-22,Бельгия д. Арсеньев бул. 50 лет Октября д. 173 стр. 2/9 619351,krilovarkadi@example.net,984164303
557,Варфоломей,Константинов,1961-10-15,Молдавия п. Анива бул. Тургенева д. 3/8 121828,kolesnikovfedor@example.com,539881297
558,Федот,Буров,1996-04-08,Монголия клх Сузун пер. Городской д. 1 к. 69 418723,radislav_1972@example.net,O66100672
559,Игнатий,Терентьев,1951-12-30,Сент-Китс и Невис к. Териберка алл. Сельская д. 8/2 стр. 343 294770,sofronmuhin@example.org,226231412
560,Август,Котов,1943-10-02,Оман ст. Плесецк наб. Пограничная д. 6 стр. 7 291046,strelkovandronik@example.net,912114397
561,Лукия,Пахомова,1957-12-27,Экваториальная Гвинея п. Котлас ул. Инженерная д. 18 214869,venedikt2024@example.net,H69793641
562,София,Ефимова,2019-09-30,Чили г. Шерегеш пер. Казанский д. 115 стр. 815 132718,leon2019@example.com,J15861307
563,Тимофей,Сафонов,1944-05-22,Марокко с. Щельяюр пр. Терешковой д. 6/2 к. 68 558539,efim1981@example.com,A37468723
564,Иванна,Кузнецова,2014-11-26,Румыния д. Тверь пр. 60 лет СССР д. 9/8 стр. 8 224492,artem_1985@example.com,845459982
565,Валентина,Суханова,1951-01-11,Вьетнам д. Курск пер. Производственный д. 9 622685,nikifor_2024@example.net,669045070
566,Кир,Селезнев,2007-05-11,Бразилия с. Горячий Ключ алл. Колхозная д. 38 к. 208 364726,bojan_03@example.com,695941493
567,Тит,Белова,1982-02-02,Эстония д. Холмогоры пр. Коллективный д. 9/5 к. 4/6 936429,fedoseevaalla@example.com,H14385593
568,Корнил,Медведев,1982-02-18,Эсватини г. Мыс Шмидта наб. Союзная д. 24 стр. 588 190698,emeljanovsamuil@example.org,O92711862
569,Анастасия,Волков,1971-02-04,Сан-Томе и Принсипи с. Камень-на-Оби пер. Пригородный д. 1/3 382477,fortunat_30@example.net,X48606513
570,Николай,Самойлова,1952-12-01,Лихтенштейн д. Плесецк наб. Пожарского д. 1/1 631622,lkudrjashov@example.com,070915669
571,Радим,Кириллова,1975-04-11,Эритрея п. Аргаяш ш. Крупской д. 9 к. 73 044155,radovan_2015@example.net,212551984
572,Евдокия,Петрова,2021-07-06,Босния и Герцеговина д. Плес пер. Кошевого д. 4/9 стр. 5 657402,aleksandr90@example.org,Q74853196
573,Степан,Ситникова,2001-02-15,Уругвай ст. Шелехов бул. Угловой д. 2 стр. 927 595523,hohlovavalerija@example.org,W27815097
574,Агафон,Калашников,1989-02-03,Гвинея-Бисау клх Талдом наб. Подлесная д. 741 стр. 991 751323,gerasim2004@example.net,917721145
575,Карп,Молчанова,1976-07-06,Сенегал д. Ступино бул. Речной д. 663 784168,varfolome_1974@example.net,B18750347
576,Аверьян,Савин,1993-02-12,Центральноафриканская Республика с. Салават алл. Кузнечная д. 4/4 961017,jakub_52@example.net,W10699520
577,Ратибор,Богданов,1993-06-20,Албания ст. Южно-Курильск пер. Кошевого д. 4 010986,kborisov@example.org,899615078
578,Ульян,Пестов,1982-03-14,Йемен п. Киров (Вятка) наб. Жуковского д. 606 803473,filatovustin@example.org,982189650
579,Анна,Архипов,2004-04-06,Мозамбик д. Ангарск алл. Бажова д. 516 стр. 3/8 583155,valentin_2000@example.com,O64614849
580,Кузьма,Субботин,1977-10-19,Россия ст. Дмитров алл. Загородная д. 9/9 стр. 6 474564,sevastjan1993@example.net,775118937
581,Гаврила,Агафонов,1959-04-22,Сьерра-Леоне к. Губаха бул. Парижской Коммуны д. 2 150584,vovchinnikova@example.com,754306513
582,Милан,Артемьева,1992-12-30,Израиль п. Кропоткин (Краснод.) пр. Полевой д. 9/1 451520,apollondenisov@example.net,670092017
583,Самуил,Исаков,1966-05-28,Венгрия к. Адлер бул. Ангарский д. 79 909485,zinovevruben@example.org,U68610527
584,Нонна,Никифоров,1999-10-26,Коста-Рика г. Миасс бул. Черемуховый д. 5 615030,ppotapov@example.org,456768481
585,Мариан,Воронова,1988-05-18,Бангладеш д. Бийск ш. Пирогова д. 1/3 к. 6 805519,rodionovandronik@example.org,X88225998
586,Галактион,Ермакова,1952-01-10,Вьетнам д. Карабудахкент алл. Фадеева д. 44 к. 3/5 518619,igureva@example.com,053013926
587,Авдей,Уварова,1982-01-16,Кирибати п. Кашхатау пер. Дальний д. 329 к. 463 723345,izmail_1988@example.com,137119019
588,Святополк,Колобова,2001-07-19,Уругвай к. Луховицы пр. Магистральный д. 165 179025,sigizmund_21@example.com,227314893
589,Денис,Щукин,1954-03-22,Литва ст. Нягань наб. Белорусская д. 2 стр. 81 443066,ygrigorev@example.net,151510089
590,Януарий,Дементьев,1952-02-28,Тринидад и Тобаго п. Нефтекамск пр. Таежный д. 12 к. 532 816736,spanfilov@example.org,G42366121
591,Сила,Корнилова,2014-01-09,Мавритания ст. Сунтар бул. Полтавский д. 732 к. 1/6 975947,simon_72@example.net,D37897545
592,Касьян,Зимин,2008-05-25,Науру г. Куртамыш пер. Крестьянский д. 33 к. 6 726074,mihalovsidor@example.net,760689956
593,Платон,Пестов,1998-03-13,Непал г. Надым пр. Морской д. 18 693795,sevastjan1985@example.net,T52364141
594,Зосима,Кулагин,1950-09-05,Судан п. Ведено пер. 40 лет Октября д. 6 к. 4/3 383102,budimir_1990@example.org,717041653
595,Анастасия,Белякова,1966-12-20,Эстония д. Минеральные Воды пер. Молодежный д. 1 стр. 62 694717,nponomareva@example.org,022399448
596,Лучезар,Терентьев,1996-01-13,Андорра клх Темрюк пр. 60 лет Октября д. 3 к. 2 546799,simonovvarlaam@example.net,C62201192
597,Антонин,Тихонов,1956-05-27,Бахрейн п. Бугульма ш. Крестьянское д. 4 070333,karpovtrifon@example.net,N17185805
598,Юлия,Кабанова,2016-09-17,Бельгия п. Югорск ш. Лазо д. 86 к. 38 333480,fokinaakulina@example.net,X54065166
599,Иларион,Доронина,1966-10-13,Маршалловы Острова клх Дербент ул. 8 Марта д. 85 403804,sidorovmarian@example.net,099151100
600,Юлия,Гришин,2010-09-23,Индия с. Старый Оскол алл. Тамбовская д. 427 к. 353 616730,gorde2003@example.org,250670050
601,Афиноген,Петухов,2020-01-11,Кувейт г. Вологда наб. Угольная д. 8 397420,shirjaevaakulina@example.org,A98528323
602,Панкратий,Воробьев,1998-03-11,Малави к. Петрозаводск ул. Красных Партизан д. 4 542216,kalininustin@example.com,P98362685
603,Зоя,Тарасова,1965-02-11,Белоруссия г. Снежногорск (Мурм.) ш. Линейное д. 16 к. 6/7 150589,bobrovapollon@example.org,P34437448
604,Платон,Абрамова,1964-09-11,Уругвай ст. Катайск пер. Таежный д. 6 стр. 79 102193,nestor1986@example.net,506031386
605,Фаина,Тимофеев,1988-08-18,Греция ст. Уренгой пер. Ермака д. 7 778877,svetlana97@example.org,168269873
606,Лавр,Никонов,1957-07-03,Перу п. Сальск бул. Володарского д. 5 стр. 5/5 404091,pantelemon_2023@example.com,056943298
607,Прокл,Захарова,1952-01-31,Джибути п. Рубцовск пер. Калинина д. 109 к. 24 241144,vjacheslav_93@example.org,N84918191
608,Эмилия,Беспалов,2020-01-02,Канада с. Осташков пер. Седова д. 497 к. 867 243651,olga_60@example.com,924714864
609,Синклитикия,Котов,1995-10-27,Россия п. Якутск ул. Кубанская д. 4 стр. 726 073417,eremebogdanov@example.com,368622473
610,Леонтий,Егорова,1983-05-19,Сингапур п. Раменское пер. Тепличный д. 2/2 стр. 22 951999,borislavtsvetkov@example.net,252025121
611,Флорентин,Гущина,1954-07-02,Камбоджа г. Шенкурск ул. Попова д. 1 к. 59 336372,hohlovevlampi@example.net,733615045
612,Лазарь,Калинин,2008-10-03,Словакия д. Кунгур алл. Беляева д. 189 стр. 343 105307,vladilen1979@example.com,O91283572
613,Твердислав,Тимофеева,1947-11-11,Гамбия д. Красногорск (Моск.) наб. Декабристов д. 1/3 к. 29 941170,solomon2010@example.net,713737910
614,Михаил,Гордеева,1965-05-06,Никарагуа клх Ковров наб. Нахимова д. 3 348622,leonid1983@example.org,954830961
615,Велимир,Филатова,1946-03-04,Швейцария п. Гремячинск (Бурят.) ш. Комсомольское д. 7/1 к. 1 507557,hromanova@example.com,Y01995388
616,Ефим,Потапов,2010-07-18,Мадагаскар клх Тольятти пер. Курчатова д. 9 стр. 8/8 651716,ljubosmisl_03@example.org,S98548967
