id,name,surname,birthday,address,email,passport
0,Всемил,Титова,1975-03-04,Монголия ст. Нижневартовск бул. Пирогова д. 4 стр. 3 176642,sidor1983@example.net,Z43504413
1,Сидор,Назаров,1970-12-24,Кувейт к. Горячий Ключ наб. Р.Люксембург д. 56 011217,dorofe37@example.com,715960836
2,Всеслав,Громова,1983-10-19,Маршалловы Острова д. Елабуга пер. Таежный д. 825 к. 800 558831,sergeevaagata@example.net,U22061692
3,Гремислав,Капустина,1944-12-29,Андорра к. Кырен бул. Энгельса д. 984 474855,valentinartemev@example.org,Y56948098
4,Симон,Ильин,1950-10-03,Центральноафриканская Республика д. Кандалакша наб. Волочаевская д. 6 стр. 92 819837,rpanfilova@example.org,I82275158
5,Лидия,Пестов,1992-01-30,Монголия с. Кунгур бул. Иркутский д. 7/6 стр. 1/9 651567,eosipova@example.com,251749006
6,Софон,Муравьев,1987-09-26,Коморы к. Карачаевск пр. Полтавский д. 351 к. 1 019149,aalekseev@example.net,111839608
7,Оксана,Лобанов,2014-10-05,Тринидад и Тобаго ст. Кудымкар пер. Фурманова д. 5/1 стр. 41 919851,antonintarasov@example.com,X58263860
8,Агап,Исаков,1950-08-29,Боливия п. Александровск наб. Виноградная д. 42 398037,borislav_1979@example.org,L99880113
9,Марфа,Николаев,1969-08-11,Бурунди д. Ельня бул. Парижской Коммуны д. 672 стр. 4/1 234226,savinaeleonora@example.com,H96332605
10,Екатерина,Третьяков,2002-12-23,Йемен к. Приморско-Ахтарск ш. Магистральное д. 3/3 121212,eduardmjasnikov@example.org,438764323
11,Кондратий,Беспалова,2000-05-01,Самоа д. Новороссийск ул. Октября д. 371 к. 232 648147,antip_22@example.net,B38897867
12,Клавдий,Савина,1965-10-14,Румыния клх Нефтегорск (Самар.) ул. Володарского д. 1/9 640518,alekseevakim@example.net,250362128
13,Зоя,Агафонова,2013-08-12,Эфиопия к. Алапаевск бул. Докучаева д. 27 к. 5 181122,dobroslavbelozerov@example.org,F89582143
14,Семен,Никитин,1949-11-12,Шри-Ланка д. Мончегорск наб. Февральская д. 4 к. 8 413515,grigorevnikandr@example.org,880948193
15,Аггей,Анисимов,2003-03-08,Эсватини к. Саянск ш. Кооперативное д. 972 стр. 3 280211,nnikiforov@example.com,W11613725
16,Виталий,Артемьев,2009-06-13,Швеция с. Наро-Фоминск ш. Краснознаменное д. 30 стр. 57 326784,vasilisa06@example.org,P15632302
17,Святополк,Рябова,1947-02-01,Гвинея-Бисау г. Кулу ш. Западное д. 9/4 к. 6/3 819545,konovalovapolina@example.com,177450959
18,Капитон,Филиппова,1963-06-19,Грузия п. Сосногорск алл. Енисейская д. 11 стр. 4/2 353933,vissarionmamontov@example.net,723224288
19,Геннадий,Нестерова,1995-05-11,Мадагаскар ст. Серов бул. Маяковского д. 3/2 стр. 831 327377,irakli_71@example.org,W62814253
20,Порфирий,Денисов,2016-02-02,Дания г. Малоярославец алл. Карбышева д. 943 к. 3/6 180009,blohinviktor@example.com,739531227
21,Анжела,Николаева,1946-11-14,Молдавия к. Бавлы наб. Мира д. 935 848428,kuznetsovkuprijan@example.com,U88634673
22,Боян,Ковалев,1970-03-17,Филиппины с. Усть-Катав ш. Снежное д. 3/1 к. 129 546926,sidorovterenti@example.org,K98877788
23,Виссарион,Шарапова,1958-09-11,Япония с. Орел пр. Ленинский д. 61 839960,stojannikitin@example.com,G40473635
24,Варвара,Артемьев,1969-10-28,Иран клх Мыс Шмидта бул. Бульварный д. 6/6 244046,timurkomissarov@example.org,819764419
25,Нина,Кулагин,1980-11-25,Бруней п. Уварово пр. Энергетиков д. 461 540771,mefodi_2014@example.net,I97843392
26,Рубен,Тарасов,1945-03-27,Вануату д. Рыльск бул. Вокзальный д. 48 к. 373 820343,nonna1982@example.net,J35957842
27,Изот,Фокин,1988-08-18,Сенегал г. Сочи пр. Крестьянский д. 7 к. 6/3 208646,viktorinpestov@example.net,300378376
28,Мирон,Овчинникова,1965-03-08,Узбекистан клх Белоярский пер. Полтавский д. 2 к. 4 240144,jbespalova@example.com,D73780629
29,Мариан,Тимофеева,1980-08-17,Парагвай клх Анива алл. Высоковольтная д. 35 263786,dtihonov@example.net,699463360
30,Любим,Емельянова,2023-05-16,Экваториальная Гвинея ст. Новый Оскол алл. Жуковского д. 750 к. 52 949701,anastasija80@example.net,838321476
31,Демьян,Терентьева,2008-11-04,Узбекистан клх Бугульма пер. Гончарова д. 2/4 к. 804 202124,isidordementev@example.com,H48006934
32,Назар,Козлова,1970-03-18,Бурунди г. Белорецк ул. Верхняя д. 4 стр. 49 736349,demidorehov@example.net,O21901240
33,Радислав,Данилова,2006-02-12,Никарагуа ст. Светлогорск (Калин.) пр. Максима Горького д. 3/2 868996,samsonovavalentina@example.com,N78045644
34,Денис,Баранов,2006-09-02,Сьерра-Леоне д. Балашов алл. Народная д. 850 стр. 61 282959,marina_85@example.net,G51950750
35,Адриан,Куликова,1961-01-24,Либерия г. Урай ш. Октябрьское д. 80 545527,valerija_1997@example.com,411548426
36,Эрнест,Галкина,2006-10-30,Шри-Ланка г. Адлер бул. Рязанский д. 2 817468,haritonovaverki@example.net,484858309
37,Игорь,Коновалова,1971-03-02,Ямайка ст. Елец ул. Казанская д. 137 стр. 345 081901,popovaljudmila@example.com,V88386572
38,Савелий,Волков,1948-09-08,Ливия п. Абинск алл. Папанина д. 99 к. 6 346012,parfen_1986@example.net,132508066
39,Пелагея,Филиппов,1957-02-05,Белоруссия д. Кулунда наб. Космическая д. 4 стр. 828 512459,guri58@example.org,W24591094
40,Ладимир,Жданов,1958-04-20,Малави д. Верхний Баскунчак пер. Пушкина д. 476 к. 93 674896,sitnikovamarija@example.org,I97254562
41,Кир,Русакова,1967-02-24,Танзания г. Смоленск ул. Рязанская д. 1 901399,potapovanisim@example.com,R55409442
42,Ангелина,Орехов,1992-03-01,Сенегал г. Корсаков бул. Сплавный д. 2 стр. 1 478560,ratibor1993@example.com,W01126418
43,Игорь,Казаков,1983-07-19,Словакия с. Черкесск пр. Гражданский д. 425 к. 74 026771,ereme2010@example.net,X25655732
44,Аким,Дьячкова,1998-01-20,Катар д. Джейрах ш. Ворошилова д. 346 стр. 2 452496,kir_2019@example.net,R47787892
45,Алевтина,Терентьева,1957-10-21,Палау г. Быково (метеост.) ш. Высокое д. 202 стр. 8/3 366887,fevronija_2011@example.org,950192662
46,Олимпиада,Лаврентьева,2020-02-09,Тонга д. Териберка ш. Бригадное д. 1 167952,tatjana_1973@example.com,919537327
47,Евстафий,Тихонова,2010-10-12,Германия клх Лагань ул. Краснопартизанская д. 2/5 к. 744 443565,ysazonov@example.org,Q84549817
48,Аристарх,Русаков,1974-10-07,Германия клх Южноуральск алл. Космическая д. 8/8 стр. 2/2 990023,ksenija2000@example.org,J09105724
49,Варфоломей,Иванова,1999-01-13,Лесото п. Троицк (Моск.) ш. Макаренко д. 5 475688,innokenti_05@example.net,977216585
50,Анжела,Муравьев,1986-06-02,Новая Зеландия клх Прохладный пер. Свердлова д. 3 984442,makarkrjukov@example.com,561619420
51,Амвросий,Мамонтов,1989-01-30,Того с. Раменское пр. Коммунаров д. 17 стр. 3 868977,oleg_82@example.net,726613271
52,Христофор,Архипова,1954-05-20,Литва клх Борзя пер. Островского д. 44 к. 422 956626,odintsovemeljan@example.org,R43230959
53,Савватий,Никитин,1996-06-09,Таиланд клх Иваново пер. Островского д. 795 стр. 4 952914,alekse_86@example.com,Q17327797
54,Эммануил,Корнилова,2003-07-08,Япония клх Кудымкар бул. Кубанский д. 97 к. 7/6 736254,shchukintit@example.net,G26558361
55,Твердислав,Дмитриева,1971-12-14,Бутан ст. Алексин ул. Кирпичная д. 4 к. 1/7 862209,kolobovairaida@example.org,020534513
56,Стоян,Кулагина,1967-11-02,Того п. Чулым ул. Кузнецкая д. 547 360781,ipati59@example.net,213279305
57,Агафон,Ситников,2002-04-30,Сан-Марино ст. Казань бул. Смоленский д. 9 к. 2 773891,ekaterina1994@example.net,W62246321
58,Селиван,Шубин,1969-05-09,Монако п. Гремячинск (Бурят.) алл. Коммунальная д. 91 735951,muravevnestor@example.com,145589346
59,Ефим,Сергеева,2005-09-16,Мальта ст. Новая Игирма бул. Путевой д. 770 стр. 3 365644,mamontoviosif@example.com,800003413
60,Фадей,Терентьев,1985-06-07,Коморы п. Москва МГУ ул. Ульянова д. 336 стр. 3/4 902167,konstantinbragin@example.com,P71746192
61,Эрнест,Молчанова,1959-07-29,Великобритания ст. Чикола бул. Шаумяна д. 82 стр. 92 136655,judinmilan@example.org,317839533
62,Семен,Шашкова,1999-02-17,Перу п. Ребриха бул. Нахимова д. 7/7 стр. 962 156663,trifon30@example.org,N49784815
63,Моисей,Козлова,1951-05-04,Мозамбик ст. Боровск пр. Песчаный д. 5/9 962542,kopilovtimur@example.com,E64650884
64,Венедикт,Романов,1980-06-04,Йемен с. Кош-Агач ш. Малое д. 1 к. 1/1 798636,kononovsilanti@example.com,146500591
65,Евдокия,Суханова,2004-06-11,Бельгия с. Зеленогорск (Ленин.) бул. Октября д. 5/6 к. 181 638469,martjankudrjavtsev@example.org,984006556
66,Таисия,Рогова,1972-08-18,Шри-Ланка к. Поронайск пр. 50 лет ВЛКСМ д. 613 стр. 308 990062,idjachkov@example.net,Z19159541
67,Макар,Корнилов,2007-08-13,Аргентина к. Якутск ул. Прохладная д. 23 стр. 8 111440,zikovstojan@example.org,N41335606
68,Елизавета,Боброва,1961-07-18,Нигерия клх Анапа ул. Энергетиков д. 55 к. 9 160634,nazarovakira@example.net,Z19973980
69,Матвей,Емельянова,2018-12-22,Науру п. Южно-Курильск ш. Восточное д. 32 стр. 2/2 098766,gmjasnikova@example.com,874427859
70,Артем,Цветкова,1945-03-05,Кабо-Верде д. Нальчик ш. Ильича д. 5 к. 3/1 031860,avde1971@example.net,U60978935
71,Онуфрий,Сорокина,2007-04-03,Колумбия г. Корсаков наб. Балтийская д. 1/5 691297,alapin@example.org,350301087
72,Лавр,Кузнецова,1999-12-13,Италия к. Мокшан наб. Зои Космодемьянской д. 6 691355,ktrofimova@example.net,W10719510
73,Нифонт,Лобанов,1987-10-16,Великобритания г. Уренгой ул. Никитина д. 56 054267,rogovaevdokija@example.net,153554562
74,Эммануил,Фадеев,1994-10-07,Республика Конго п. Бузулук ул. Киевская д. 1 стр. 291 287695,zhdanovafanasi@example.net,839298786
75,Зиновий,Зайцева,2007-11-28,Мавритания клх Тамбов ш. Никитина д. 301 стр. 4 631937,timur_69@example.net,Q98967866
76,Жанна,Пестова,1980-01-29,Демократическая Республика Конго ст. Озеры ул. Песочная д. 62 716436,martjan_2003@example.org,I04498818
77,Касьян,Дорофеева,1962-06-14,Белиз ст. Артем наб. Достоевского д. 987 445213,avgust2019@example.org,A95188653
78,Еремей,Горшкова,2017-11-12,Никарагуа г. Вуктыл ш. Садовое д. 939 к. 2 538591,kulaginkuzma@example.com,Y78107678
79,Аверьян,Антонов,1987-08-06,Доминика п. Владикавказ пер. Северный д. 393 к. 2 743817,harlampi2021@example.org,628696358
80,Архип,Самсонова,1975-10-19,Венесуэла п. Мирный наб. Студенческая д. 84 стр. 588 502280,vsevolod2004@example.net,897738701
81,Моисей,Блинов,1956-03-19,Грузия д. Озеры алл. Гаражная д. 50 к. 509 995133,samsongrishin@example.net,H65660727
82,Глеб,Королева,1944-06-02,Норвегия с. Усть-Камчатск бул. Металлургов д. 70 стр. 9/9 985196,tatjana_06@example.org,A69267544
83,Аскольд,Белоусов,2013-07-25,Эстония с. Каменск-Шахтинский ш. Мелиоративное д. 15 стр. 7 280986,kalashnikovpantelemon@example.com,483236518
84,Елизавета,Петухов,1958-06-05,Сербия к. Кемерово бул. Новгородский д. 8 стр. 16 812699,rmishina@example.com,881309729
85,Людмила,Дмитриев,2006-08-11,Доминика с. Плес наб. Культуры д. 1 501509,gerasim2020@example.org,355169732
86,Валерия,Борисов,1993-01-31,Малайзия ст. Сыктывкар ул. Красноармейская д. 504 614353,ladimir_2009@example.net,I43480934
87,Аггей,Ермаков,1992-08-08,Люксембург п. Улан-Удэ пер. Депутатский д. 433 стр. 2 493909,naum1970@example.net,K79885179
88,Роман,Вишнякова,2021-06-03,Бразилия к. Мценск наб. Калинина д. 219 стр. 79 058276,kalininjan@example.net,363751345
89,Нина,Назаров,1985-10-03,Испания с. Красноуфимск ш. Дорожное д. 1 376857,qodintsov@example.net,W95965042
90,Лариса,Федотов,1967-07-12,Ямайка с. Березники бул. Машиностроителей д. 12 к. 91 677922,mgrishina@example.org,L85334804
91,Юрий,Афанасьева,1977-11-10,Россия клх Мезень бул. Максима Горького д. 3 517939,lapinemeljan@example.net,V23595918
92,Игнатий,Миронов,1979-02-16,Германия д. Брянск пер. Надежды д. 173 256100,kimharitonov@example.org,M87238162
93,Нина,Савина,2020-12-06,Палау д. Северобайкальск ш. Достоевского д. 247 335427,hariton1976@example.org,608041375
94,Милица,Гурьев,1956-12-31,Республика Корея п. Барнаул наб. Енисейская д. 333 стр. 35 829790,mironlukin@example.com,076502276
95,Ратмир,Сергеева,2014-09-18,Лаос ст. Белый Яр (Томск.) пр. Алтайский д. 4 к. 4/7 565755,pankrat_2006@example.com,K66411035
96,Викторин,Самсонова,1960-12-08,Сомали д. Троицко-Печорск наб. Р.Люксембург д. 2/6 к. 725 570936,egor_05@example.org,Y84873093
97,Филипп,Федотова,2007-08-19,Гана г. Шереметьево пер. Жуковского д. 9 108511,potapovaantonina@example.com,A43713824
98,Петр,Сидорова,1994-01-23,Тринидад и Тобаго п. Хоста бул. Первомайский д. 5 к. 7/4 965644,selivan71@example.com,226220753
99,Ювеналий,Максимова,1949-08-13,Джибути д. Дно ул. Логовая д. 163 к. 864 783907,radim47@example.net,215004443
100,Ефим,Хохлова,1988-12-27,Израиль г. Великий Устюг пер. Угольный д. 46 к. 8 305741,januari_68@example.net,809984064
101,Наина,Горшкова,1976-01-16,Австралия клх Саратов алл. Красноярская д. 7/7 689213,fedosiribakov@example.org,070137285
102,Аникей,Никонова,1983-11-09,Ливия клх Анадырь ул. Горная д. 266 стр. 161 112837,egorovtrofim@example.net,429861822
103,Ия,Архипов,1977-04-10,Сомали д. Мыс Шмидта ул. Проточная д. 884 к. 5 006253,ivan1972@example.com,T70702470
104,Алевтина,Журавлев,1992-12-18,Турция с. Жиганск пер. Коммунаров д. 915 к. 401 840570,komissarovartem@example.org,882726424
105,Пелагея,Ефимов,1956-02-25,Япония д. Домбай пр. Новгородский д. 41 337582,faina_2012@example.org,O22152912
106,Василий,Морозова,1964-11-25,Сьерра-Леоне п. Волоколамск бул. Демьяна Бедного д. 173 к. 1/8 139162,eliseevaveronika@example.org,M55585287
107,Олимпий,Соловьев,2004-02-20,Таиланд клх Раменское ул. Энгельса д. 73 789434,shashkovavera@example.org,U87702979
108,Данила,Никитин,1984-07-28,Италия п. Темрюк пер. Дачный д. 7/8 стр. 3/7 627637,kalashnikovaanzhelika@example.net,K45250373
109,Вадим,Селиверстова,1967-01-01,Зимбабве к. Троицк (Челяб.) алл. Станционная д. 9 стр. 7/1 479965,tit85@example.com,268026199
110,Милица,Шубин,1991-06-18,Замбия к. Домодедово пер. 40 лет Октября д. 6 стр. 383 065846,landreev@example.org,J51844402
111,Тимофей,Бирюкова,1968-12-28,Доминиканская Республика д. Энгельс ул. Камская д. 7/1 497972,ija2002@example.com,360628452
112,Зиновий,Красильникова,1966-06-16,Андорра п. Ардон пер. М.Горького д. 7/1 стр. 80 338476,efimovaelizaveta@example.org,338723133
113,Филарет,Никифорова,1957-02-01,Кения д. Нижневартовск пер. Репина д. 78 907540,florentinkabanov@example.org,P54550158
114,Никон,Беляева,2017-05-23,Египет г. Советский пер. Красногвардейский д. 460 250963,seleznevluchezar@example.net,J94348046
115,Иларион,Селезнев,1973-02-22,Гренада клх Байкальск ул. Микрорайон д. 671 128932,vitali_2009@example.net,454748614
116,Герасим,Мельников,1979-09-23,Камерун ст. Таштагол пер. Клубный д. 506 стр. 4/1 027393,evgeni_1996@example.com,H78224404
117,Синклитикия,Лебедев,1947-02-08,Кот-д’Ивуар к. Хатанга пр. Волкова д. 2 стр. 26 913376,eleonora98@example.com,Q90894154
118,Аполлон,Титова,1951-08-25,Тонга п. Усть-Кут пер. Заозерный д. 3 252197,martinovsimon@example.net,Y96583362
119,Тарас,Кулагина,1991-11-13,Вануату г. Змеиногорск пр. Кирпичный д. 85 к. 78 696354,efrem1994@example.org,N36186950
120,Фирс,Антонов,1991-04-05,Кувейт к. Апатиты ул. Л.Толстого д. 899 к. 750 665408,akulina_2009@example.org,V21481188
121,Потап,Горбунова,1960-05-02,Бруней п. Кириши пр. Цветочный д. 791 стр. 380 010659,savinkasjan@example.com,729548654
122,Лидия,Лукина,2013-07-30,Йемен п. Новомичуринск алл. Союзная д. 6 616482,nchernova@example.com,026474065
123,Фёкла,Абрамова,1970-08-31,Ливия г. Златоуст пр. Маяковского д. 8/7 492485,eisaeva@example.org,487459902
124,Еремей,Шубин,2004-01-16,Перу с. Оленек пр. Новосельский д. 23 стр. 1 868416,qlebedev@example.net,382346631
125,Октябрина,Русаков,1966-11-03,Туркмения к. Муром пр. 60 лет Октября д. 5/4 к. 776 773966,marian07@example.org,J68411220
126,Ефрем,Журавлева,1944-12-06,Ямайка ст. Видное бул. Ростовский д. 9 стр. 7/2 565514,safonovnestor@example.org,O58808147
127,Никон,Кулаков,1963-12-01,Новая Зеландия к. Беломорск пр. Льва Толстого д. 91 546797,budimirnekrasov@example.net,384640242
128,Викентий,Бобылев,2016-10-01,Гана к. Сортавала наб. Демьяна Бедного д. 70 стр. 287 679835,kallistrat39@example.net,L52672646
129,Мирослав,Фомин,1959-06-05,Маршалловы Острова с. Торжок пр. Макаренко д. 58 стр. 936 979626,rubennosov@example.com,W67830029
130,Иларион,Евдокимов,1997-05-09,Сент-Винсент и Гренадины к. Катайск бул. Сахалинский д. 10 к. 69 385539,miroslav1978@example.net,096714339
131,Анна,Ильин,1971-12-31,Гана д. Шенкурск ул. Толбухина д. 998 148160,braginlukjan@example.net,241772554
132,Прокофий,Уваров,1969-04-29,Коморы ст. Тутаев ш. Панфилова д. 449 727385,foti41@example.net,594655369
133,Евгений,Алексеева,1984-09-09,ЮАР клх Забайкальск алл. Стахановская д. 487 965083,dvoronov@example.com,U72647054
134,Адриан,Симонов,2004-12-01,Германия с. Аршан (Бурят.) пр. Ключевой д. 718 674161,gleb_24@example.net,460372926
135,Еремей,Панова,2011-05-12,Маршалловы Острова с. Сорочинск наб. Энгельса д. 3 558474,firssitnikov@example.com,W18764605
136,Савва,Мясников,1953-03-11,Йемен п. Сковородино пр. 50 лет Октября д. 42 101752,semen1992@example.net,W35926415
137,Дементий,Ильина,1984-01-05,Эфиопия клх Саянск ул. Геологов д. 3 449703,arhipovgrigori@example.org,978654740
138,Викентий,Некрасов,1953-12-18,Таджикистан д. Тамбей ул. Щетинкина д. 58 стр. 6 692200,ujudin@example.net,286085369
139,Лонгин,Дмитриева,1951-08-12,Мальдивы клх Домбай пер. Пролетарский д. 1 стр. 845 353640,zhdanovdobroslav@example.net,478678844
140,Анисим,Кошелев,1986-10-12,Лаос п. Томари пр. Широкий д. 8 стр. 5/1 031259,platon2015@example.com,106577987
141,Порфирий,Мартынова,1991-07-19,Северная Македония клх Серафимович пер. Пирогова д. 24 стр. 29 775917,uosipov@example.org,Z01948518
142,Давыд,Сергеев,1974-07-21,Маврикий г. Прохладный бул. Черемуховый д. 9/2 к. 9/4 185798,ilinaagata@example.org,369722042
143,Клавдий,Боброва,2021-10-08,Франция ст. Яр-Сале пер. Ушакова д. 228 648255,zaharovamarfa@example.org,P26289463
144,Герасим,Орехов,2021-11-06,Колумбия ст. Ясный (Оренб.) пер. Пушкинский д. 5 701424,jakubbikov@example.net,507477320
145,София,Самойлова,1961-06-10,Доминика д. Светлогорск (Калин.) пер. Осенний д. 7 к. 24 886427,savvatitrofimov@example.org,148098489
146,Дарья,Галкина,2018-12-31,Сент-Китс и Невис клх Раменское ул. Жукова д. 3 к. 903 116042,margarita_15@example.com,611903801
147,Ерофей,Воронова,1950-04-24,Гамбия к. Красноуфимск пер. Ульяновский д. 240 316669,makarkovalev@example.net,944444697
148,Марина,Абрамов,1979-04-04,Республика Корея г. Тура наб. Павлова д. 370 к. 669 424306,gleb52@example.com,443839351
149,Феоктист,Горбачева,1972-12-23,Эритрея ст. Кисловодск бул. Чехова д. 2 028675,karp1984@example.org,195591760
150,Ипполит,Федотов,1947-02-13,Бурунди с. Александровск ш. Трудовое д. 4/2 стр. 6 724297,pimen41@example.net,314811488
151,Чеслав,Рябова,2006-06-19,Федеративные Штаты Микронезии с. Новочеркасск ш. Гражданское д. 60 стр. 683 378072,abramovalora@example.com,082361030
152,Лукьян,Капустина,1950-01-15,Южный Судан клх Устюжна пр. Фадеева д. 424 к. 8/8 687455,lgalkina@example.org,R16086040
153,Евсей,Быков,1980-06-24,Гайана ст. Ялуторовск пер. Севастопольский д. 4/4 086530,rogovanina@example.net,A61644159
